source,headline,date,query_source,label
Academic Augmentation,Factual update: Nasdaq trading volume holds steady,2026-06-13,AUGMENTED,NEUTRAL
Academic Augmentation,Natural Gas index undergoes annual rebalancing with minimal impact,2026-06-13,AUGMENTED,NEUTRAL
Academic Augmentation,Why the market is ignoring bad news and buying Oil anyway,2026-06-13,AUGMENTED,COGNITIVE_DISSONANCE
Academic Augmentation,Standard contract updates finalized for US Dollar futures traders,2026-06-13,AUGMENTED,NEUTRAL
Academic Augmentation,Oil price surges even as regulatory warning signals emerge,2026-06-13,AUGMENTED,COGNITIVE_DISSONANCE
Academic Augmentation,New study evaluates historical performance trends of S&P 500,2026-06-13,AUGMENTED,NEUTRAL
Google News Search,Retail Crowd Beats the S&P 500 as Soaring Trading Sparks Concern,2025-10-10,HERD,HERD
Academic Augmentation,Loss aversion keeps investors trapped in losing Oil positions,2026-06-13,AUGMENTED,LOSS_AVERSION
Academic Augmentation,"Nasdaq settles at $60,000 on Thursday afternoon trade",2026-06-13,AUGMENTED,NEUTRAL
Academic Augmentation,Follow-the-crowd behavior causes sharp retail drawdown in Ethereum,2026-06-13,AUGMENTED,HERD
Academic Augmentation,Local governments issue guidelines on Crypto markets resource management,2026-06-13,AUGMENTED,NEUTRAL
Academic Augmentation,Statistical summary: Bank stocks export volumes unchanged this month,2026-06-13,AUGMENTED,NEUTRAL
Google News Search,A Winning Investment Strategy Sitting Right Under Your Nose (If You Can Hold It) - Morningstar,2025-07-01,LOSS_AVERSION,LOSS_AVERSION
Google News Search,Instant View: Markets plunge as precious metals meltdown spills over,2026-02-01,PANIC,PANIC
Google News Search,"Officer accused of taking $98,000 in bribes to fund crypto buying spree. Promised to ‘simply close’ cases - dlnews.com",2026-04-22,FOMO,FOMO
Academic Augmentation,Buying frenzy pushes Real estate to unsustainable levels,2026-06-13,AUGMENTED,FOMO
Academic Augmentation,AI stocks plunges into free fall as panic grips Wall Street,2026-06-13,AUGMENTED,PANIC
Academic Augmentation,Ignoring the red flags: Retail buyers bid up S&P 500 despite risks,2026-06-13,AUGMENTED,COGNITIVE_DISSONANCE
Academic Augmentation,Why the market is ignoring bad news and buying Meme coins anyway,2026-06-13,AUGMENTED,COGNITIVE_DISSONANCE
Google News Search,Forward Industries buys back $27 million in stock using Galaxy loan as SOL treasury faces drawdown - The Block,2026-03-19,LOSS_AVERSION,LOSS_AVERSION
Academic Augmentation,Cognitive dissonance: Markets ignore Crypto markets regulatory crackdowns,2026-06-13,AUGMENTED,COGNITIVE_DISSONANCE
Academic Augmentation,Retail investors dump Real estate in massive flocking exit,2026-06-13,AUGMENTED,HERD
Academic Augmentation,"Retail traders hold Gold bags, refusing to realize paper losses",2026-06-13,AUGMENTED,LOSS_AVERSION
Google News Search,Bitcoin’s 48% Drawdown at $66K Signals 300-Day Recovery Cycle — What Historical Data Shows - CCN.com,2026-03-30,LOSS_AVERSION,LOSS_AVERSION
Academic Augmentation,Ignoring the red flags: Retail buyers bid up Natural Gas despite risks,2026-06-13,AUGMENTED,COGNITIVE_DISSONANCE
Academic Augmentation,Follow the leader: Retail crowd copies institutional exit from Nasdaq,2026-06-13,AUGMENTED,HERD
Academic Augmentation,Piling into Crypto markets: The retail crowd refuses to stay on the sidelines,2026-06-13,AUGMENTED,FOMO
Academic Augmentation,Frightened investors dump Apple in chaotic market capitulation,2026-06-13,AUGMENTED,PANIC
Academic Augmentation,New regulatory guidelines issued for Tesla market participants,2026-06-13,AUGMENTED,NEUTRAL
Academic Augmentation,Crowd dynamics take over as investors simultaneously dump S&P 500,2026-06-13,AUGMENTED,HERD
Academic Augmentation,Public interest in AI stocks spikes as retail buyers chase momentum,2026-06-13,AUGMENTED,FOMO
Academic Augmentation,Follow-the-crowd behavior causes sharp retail drawdown in US Dollar,2026-06-13,AUGMENTED,HERD
Academic Augmentation,New regulatory guidelines issued for Ethereum market participants,2026-06-13,AUGMENTED,NEUTRAL
Academic Augmentation,Panic selling grips Bitcoin as market crashes suddenly,2026-06-13,AUGMENTED,PANIC
Academic Augmentation,FOMO grips investors as Bank stocks surges to new record highs,2026-06-13,AUGMENTED,FOMO
Academic Augmentation,Exodus from Tesla continues as investors follow the crowd,2026-06-13,AUGMENTED,HERD
Academic Augmentation,"Severe Crude Oil sell-off triggers circuit breakers, prices crash",2026-06-13,AUGMENTED,PANIC
Academic Augmentation,"Everyone is selling Nvidia, causing retail panic herd",2026-06-13,AUGMENTED,HERD
Academic Augmentation,Crowd dynamics take over as investors simultaneously dump Nasdaq,2026-06-13,AUGMENTED,HERD
Academic Augmentation,"Don't miss out on the next US Dollar rally, experts warn",2026-06-13,AUGMENTED,FOMO
Google News Search,Jakarta Stocks Defy Regional Sell-Off as Russia Oil Plan Lifts Sentiment - Jakarta Globe,2026-04-17,COGNITIVE_DISSONANCE,COGNITIVE_DISSONANCE
Academic Augmentation,Statistical summary: Apple export volumes unchanged this month,2026-06-13,AUGMENTED,NEUTRAL
Google News Search,"Volatility Is Uncomfortable, Not Dangerous: Why Panic Selling Has Cost Investors More Than Any Market Crash - The Motley Fool",2026-03-06,PANIC,PANIC
Academic Augmentation,Buying frenzy pushes Nasdaq to unsustainable levels,2026-06-13,AUGMENTED,FOMO
Academic Augmentation,Traders capitulate as Crude Oil suffers its worst day in years,2026-06-13,AUGMENTED,PANIC
Academic Augmentation,Tesla market crashes as investors capitulate in panic,2026-06-13,AUGMENTED,PANIC
Academic Augmentation,FOMO grips investors as Real estate surges to new record highs,2026-06-13,AUGMENTED,FOMO
Academic Augmentation,"Investors dismiss warnings of Nvidia correction, pushing prices higher",2026-06-13,AUGMENTED,COGNITIVE_DISSONANCE
Academic Augmentation,Follow the leader: Retail crowd copies institutional exit from Nvidia,2026-06-13,AUGMENTED,HERD
Academic Augmentation,Holding Bitcoin all the way down: The psychological cost of loss aversion,2026-06-13,AUGMENTED,LOSS_AVERSION
Google News Search,Retiring head of FINRA foundation: FOMO is investors' biggest mistake,2026-04-05,FOMO,FOMO
Google News Search,They Are Prepping for a Crash. Are You? - The Motley Fool,2026-06-10,PANIC,PANIC
Academic Augmentation,Silver defies negative analyst forecasts with surprise rally,2026-06-13,AUGMENTED,COGNITIVE_DISSONANCE
Academic Augmentation,New regulatory guidelines issued for AI stocks market participants,2026-06-13,AUGMENTED,NEUTRAL
Google News Search,Billionaire Gold Bug Eric Sprott Just Extended His Hycroft Mining Buying Spree - 24/7 Wall St.,2026-04-29,FOMO,FOMO
Google News Search,"The king of fruits has arrived, and citizens flock to buy Alphonso mangos at the Market yard in Pune - Pune Mirror",2025-08-03,HERD,HERD
Academic Augmentation,Nvidia price surges even as regulatory warning signals emerge,2026-06-13,AUGMENTED,COGNITIVE_DISSONANCE
Academic Augmentation,Industry conference discusses technical developments in Bank stocks,2026-06-13,AUGMENTED,NEUTRAL
Academic Augmentation,Factual update: Treasury yields trading volume holds steady,2026-06-13,AUGMENTED,NEUTRAL
Academic Augmentation,"Everyone is selling Silver, causing retail panic herd",2026-06-13,AUGMENTED,HERD
Google News Search,Is XRP (Ripple) Still a Good Long-Term Investment After the 2026 Drawdown? - 24/7 Wall St.,2026-05-19,LOSS_AVERSION,LOSS_AVERSION
Academic Augmentation,Retail traders trigger short squeeze in AI stocks as FOMO peaks,2026-06-13,AUGMENTED,FOMO
Google News Search,Microsoft Stock (MSFT) Opinions on AI Capex-Driven Drawdown - Quiver Quantitative,2026-04-13,LOSS_AVERSION,LOSS_AVERSION
Google News Search,How Steep Is the Plunge for Dell Stock? - Trefis,2026-06-11,PANIC,PANIC
Google News Search,"AI stock rally may be driven by fear of missing out, but strategists say hold tight",2025-12-02,FOMO,FOMO
Academic Augmentation,"Investors herd into cash, selling off Nasdaq positions in unison",2026-06-13,AUGMENTED,HERD
Google News Search,Canadian stocks defy US shutdown - Wealth Professional,2025-10-03,COGNITIVE_DISSONANCE,COGNITIVE_DISSONANCE
Google News Search,Why Redwire Stock Crashed Today,2026-06-12,PANIC,PANIC
Academic Augmentation,Speculators buy Tech stocks at all-time highs fearing further gains,2026-06-13,AUGMENTED,FOMO
Academic Augmentation,Gold price remains unchanged ahead of earnings report,2026-06-13,AUGMENTED,NEUTRAL
Academic Augmentation,Market panic triggers emergency liquidations in Apple,2026-06-13,AUGMENTED,PANIC
Academic Augmentation,"S&P 500 shrugs off bad news, continuing its rally despite macro shock",2026-06-13,AUGMENTED,COGNITIVE_DISSONANCE
Academic Augmentation,Treasury yields price fluctuates within narrow range during morning session,2026-06-13,AUGMENTED,NEUTRAL
Academic Augmentation,"Fearing they will miss the boat, retail investors flock to Tech stocks",2026-06-13,AUGMENTED,FOMO
Academic Augmentation,Nvidia price remains unchanged ahead of earnings report,2026-06-13,AUGMENTED,NEUTRAL
Academic Augmentation,Economists publish revised baseline outlook for Gold markets,2026-06-13,AUGMENTED,NEUTRAL
Google News Search,Applied Materials Overcomes a 21% Drawdown: How $700 Billion in AI CapEx Fuels the $431 Target - TIKR.com,2026-03-28,LOSS_AVERSION,LOSS_AVERSION
Academic Augmentation,New study evaluates historical performance trends of Nvidia,2026-06-13,AUGMENTED,NEUTRAL
Academic Augmentation,Plunging AI stocks prices spark widespread fear and forced selling,2026-06-13,AUGMENTED,PANIC
Academic Augmentation,Crowd dynamics take over as investors simultaneously dump AI stocks,2026-06-13,AUGMENTED,HERD
Academic Augmentation,Retail crowd scrambles to dump Ethereum as sell-off intensifies,2026-06-13,AUGMENTED,HERD
Academic Augmentation,Reluctance to take losses leads to stagnation in retail AI stocks portfolios,2026-06-13,AUGMENTED,LOSS_AVERSION
Academic Augmentation,Local governments issue guidelines on Ethereum resource management,2026-06-13,AUGMENTED,NEUTRAL
Academic Augmentation,Apple price remains unchanged ahead of earnings report,2026-06-13,AUGMENTED,NEUTRAL
Academic Augmentation,"Investors herd into cash, selling off Oil positions in unison",2026-06-13,AUGMENTED,HERD
Google News Search,XRP ETF Buying Frenzy Pushes Assets Near $1 Billion - Coinfomania,2026-06-10,FOMO,FOMO
Academic Augmentation,Silver price remains unchanged ahead of earnings report,2026-06-13,AUGMENTED,NEUTRAL
Google News Search,HYPE Whale Buying Spree Grows After Massive a16z Linked Purchase - Cryptonews.net,2026-05-15,FOMO,FOMO
Academic Augmentation,Traders capitulate as Meme coins suffers its worst day in years,2026-06-13,AUGMENTED,PANIC
Academic Augmentation,Crowd dynamics take over as investors simultaneously dump Meme coins,2026-06-13,AUGMENTED,HERD
Academic Augmentation,Factual update: US Dollar trading volume holds steady,2026-06-13,AUGMENTED,NEUTRAL
Academic Augmentation,Late-stage FOMO drives massive surge in Ethereum trading activity,2026-06-13,AUGMENTED,FOMO
Google News Search,SpaceX stock fund in Japan halts new inflows after investors pile in - Nikkei Asia,2026-06-11,FOMO,FOMO
Academic Augmentation,Loss aversion rules: Traders double down on losing AI stocks trades,2026-06-13,AUGMENTED,LOSS_AVERSION
Google News Search,Dankrad Feist Proposes $1 Billion Ethereum Advocacy Organization as EF Exodus Fuels Identity Crisis - unchainedcrypto.com,2026-05-22,HERD,HERD
Academic Augmentation,Crude Oil markets close for the weekend after quiet trading day,2026-06-13,AUGMENTED,NEUTRAL
Google News Search,Dow surges to new record as investors flee AI stocks after Broadcom selloff - AOL.com,2026-06-05,HERD,HERD
Academic Augmentation,Oil price fluctuates within narrow range during morning session,2026-06-13,AUGMENTED,NEUTRAL
Academic Augmentation,Why the market is ignoring bad news and buying AI stocks anyway,2026-06-13,AUGMENTED,COGNITIVE_DISSONANCE
Google News Search,ARK Invest Buying Spree Meets Bullish BitLicense And Institutional Ambitions,2026-02-15,FOMO,FOMO
Academic Augmentation,Fear of missing out drives massive retail inflow into Bitcoin,2026-06-13,AUGMENTED,FOMO
Academic Augmentation,Absolute carnage in Oil as selloff wipes out billions,2026-06-13,AUGMENTED,PANIC
Academic Augmentation,"Oil settles at $1,200 on Thursday afternoon trade",2026-06-13,AUGMENTED,NEUTRAL
Academic Augmentation,"Silver settles at $2,000 on Wednesday afternoon trade",2026-06-13,AUGMENTED,NEUTRAL
Google News Search,Oil and gas costs surge but some stocks defy war-focused sell-off,2026-03-02,COGNITIVE_DISSONANCE,COGNITIVE_DISSONANCE
Academic Augmentation,Traders capitulate as Treasury yields suffers its worst day in years,2026-06-13,AUGMENTED,PANIC
Academic Augmentation,Factual update: Meme coins trading volume holds steady,2026-06-13,AUGMENTED,NEUTRAL
Google News Search,Exodus Launches Ondo-Powered Markets for Tokenized Stocks and ETFs,2026-06-12,HERD,HERD
Academic Augmentation,Cognitive dissonance grows as investors buy Silver despite crash threats,2026-06-13,AUGMENTED,COGNITIVE_DISSONANCE
Academic Augmentation,Ignoring the red flags: Retail buyers bid up Bitcoin despite risks,2026-06-13,AUGMENTED,COGNITIVE_DISSONANCE
Academic Augmentation,Ethereum prices collapse by 30% in sudden panic-driven rout,2026-06-13,AUGMENTED,PANIC
Academic Augmentation,Real estate index undergoes annual rebalancing with minimal impact,2026-06-13,AUGMENTED,NEUTRAL
Google News Search,Value buying or FOMO? Investors flock to buy shares sold by MNC parents in Indian arm - Moneycontrol.com,2024-02-23,HERD,HERD
Academic Augmentation,Unwilling to sell: Retail investors hold Bank stocks through deep drawdown,2026-06-13,AUGMENTED,LOSS_AVERSION
Academic Augmentation,"Fearing they will miss the boat, retail investors flock to Nvidia",2026-06-13,AUGMENTED,FOMO
Google News Search,Bitcoin Price Flashes Rare Buy Signal as Miners Capitulate - The Coin Republic,2026-06-13,PANIC,PANIC
Academic Augmentation,Is Gold the next big thing? Retail buyers are rushing to buy,2026-06-13,AUGMENTED,FOMO
Academic Augmentation,Widespread panic triggers margin calls and liquidation of Crypto markets,2026-06-13,AUGMENTED,PANIC
Google News Search,Money-Losing Retail Crowd Keeps Buying Stocks as Market Teeters,2025-03-21,HERD,HERD
Google News Search,Exodus Launches XO Cash Stablecoin for AI Agent Payments,2026-05-08,HERD,HERD
Google News Search,"US Stock Market Today Crash, Crypto Market News [ LIVE] Updates – June 11th - Coinpedia",2026-06-11,PANIC,PANIC
Academic Augmentation,Annual meeting of AI stocks trade association scheduled for Q3,2026-06-13,AUGMENTED,NEUTRAL
Academic Augmentation,Follow the leader: Retail crowd copies institutional exit from Natural Gas,2026-06-13,AUGMENTED,HERD
Academic Augmentation,Tech stocks rally continues despite clear indicators of economic slowdown,2026-06-13,AUGMENTED,COGNITIVE_DISSONANCE
Google News Search,Midday: Aus stocks defy leads & retreat 0.6% - Finance News Network,2013-07-19,COGNITIVE_DISSONANCE,COGNITIVE_DISSONANCE
Academic Augmentation,Standard contract updates finalized for S&P 500 futures traders,2026-06-13,AUGMENTED,NEUTRAL
Academic Augmentation,"Retail traders hold Natural Gas bags, refusing to realize paper losses",2026-06-13,AUGMENTED,LOSS_AVERSION
Academic Augmentation,Retail crowd scrambles to dump US Dollar as sell-off intensifies,2026-06-13,AUGMENTED,HERD
Academic Augmentation,Cognitive dissonance: Markets ignore Bitcoin regulatory crackdowns,2026-06-13,AUGMENTED,COGNITIVE_DISSONANCE
Google News Search,Crypto firms move $4 billion in assets to Chainlink as bridge security comes under scrutiny,2026-05-15,HERD,HERD
Academic Augmentation,Natural Gas prices collapse by 15% in sudden panic-driven rout,2026-06-13,AUGMENTED,PANIC
Academic Augmentation,Scheduled regulatory review of Bitcoin completed without action,2026-06-13,AUGMENTED,NEUTRAL
Academic Augmentation,Stubborn investors refuse to cut losses on declining Apple,2026-06-13,AUGMENTED,LOSS_AVERSION
Academic Augmentation,Scheduled regulatory review of Gold completed without action,2026-06-13,AUGMENTED,NEUTRAL
Google News Search,Newcastle United unwilling to sell Lewis Hall amid Liverpool links - TheHardTackle.com,2025-03-01,LOSS_AVERSION,LOSS_AVERSION
Academic Augmentation,Holding Tech stocks all the way down: The psychological cost of loss aversion,2026-06-13,AUGMENTED,LOSS_AVERSION
Academic Augmentation,Sell-off accelerates in Tesla as fear index hits record high,2026-06-13,AUGMENTED,PANIC
Google News Search,"From FOMO to Fear of Losses, a True Fear Signal Flashes in the U.S. Stock Options Market - NAI500",2026-06-11,FOMO,FOMO
Academic Augmentation,Standard contract updates finalized for Meme coins futures traders,2026-06-13,AUGMENTED,NEUTRAL
Academic Augmentation,Standard contract updates finalized for Real estate futures traders,2026-06-13,AUGMENTED,NEUTRAL
Academic Augmentation,Frenzy in Gold options market as traders bet on massive rally,2026-06-13,AUGMENTED,FOMO
Academic Augmentation,Stubborn investors refuse to cut losses on declining S&P 500,2026-06-13,AUGMENTED,LOSS_AVERSION
Academic Augmentation,Mass retail dumping of Crypto markets triggers copycat selling,2026-06-13,AUGMENTED,HERD
Academic Augmentation,Cognitive dissonance: Markets ignore Nasdaq regulatory crackdowns,2026-06-13,AUGMENTED,COGNITIVE_DISSONANCE
Academic Augmentation,Bank stocks rally continues despite clear indicators of economic slowdown,2026-06-13,AUGMENTED,COGNITIVE_DISSONANCE
Google News Search,Solana Treasury Firm Buys Back Stock After Massive Drawdown - unchainedcrypto.com,2026-03-20,LOSS_AVERSION,LOSS_AVERSION
Google News Search,Chinese Tech Stocks Defy Asian Selloff Amid Global Crisis - streamlinefeed.co.ke,2026-06-01,COGNITIVE_DISSONANCE,COGNITIVE_DISSONANCE
Academic Augmentation,Trading volume for Oil matches three-month average,2026-06-13,AUGMENTED,NEUTRAL
Academic Augmentation,Refusing to sell: Retail bagholders cling to Bitcoin despite losses,2026-06-13,AUGMENTED,LOSS_AVERSION
Academic Augmentation,Exodus from Oil funds gathers steam amid widespread pessimism,2026-06-13,AUGMENTED,HERD
Academic Augmentation,Frightened investors dump US Dollar in chaotic market capitulation,2026-06-13,AUGMENTED,PANIC
Academic Augmentation,Reluctance to take losses leads to stagnation in retail Nvidia portfolios,2026-06-13,AUGMENTED,LOSS_AVERSION
Academic Augmentation,Frenzy in Oil options market as traders bet on massive rally,2026-06-13,AUGMENTED,FOMO
Academic Augmentation,"Investors dismiss warnings of Crypto markets correction, pushing prices higher",2026-06-13,AUGMENTED,COGNITIVE_DISSONANCE
Academic Augmentation,Retail crowd scrambles to dump S&P 500 as sell-off intensifies,2026-06-13,AUGMENTED,HERD
Academic Augmentation,Speculators buy Tesla at all-time highs fearing further gains,2026-06-13,AUGMENTED,FOMO
Google News Search,Why the crypto market is crashing - CNN,2025-11-24,PANIC,PANIC
Academic Augmentation,"Natural Gas shrugs off bad news, continuing its rally despite macro shock",2026-06-13,AUGMENTED,COGNITIVE_DISSONANCE
Academic Augmentation,"Everyone is selling Crypto markets, causing retail panic herd",2026-06-13,AUGMENTED,HERD
Academic Augmentation,Hoping for a rebound: Investors refuse to exit their losing AI stocks bets,2026-06-13,AUGMENTED,LOSS_AVERSION
Academic Augmentation,Central bank reports modest economic growth in Q1,2026-06-13,AUGMENTED,NEUTRAL
Academic Augmentation,Frightened investors dump Crude Oil in chaotic market capitulation,2026-06-13,AUGMENTED,PANIC
Academic Augmentation,"US Dollar down 15%, but investors hold tight hoping to break even",2026-06-13,AUGMENTED,LOSS_AVERSION
Academic Augmentation,Statistical summary: Treasury yields export volumes unchanged this month,2026-06-13,AUGMENTED,NEUTRAL
Academic Augmentation,Natural Gas markets close for the weekend after quiet trading day,2026-06-13,AUGMENTED,NEUTRAL
Academic Augmentation,Stubborn investors refuse to cut losses on declining Tesla,2026-06-13,AUGMENTED,LOSS_AVERSION
Google News Search,"Bitcoin Price Plunges 50%, Drawdown Nears FTX-Era Crash - Bitcoin Magazine",2026-02-05,LOSS_AVERSION,LOSS_AVERSION
Academic Augmentation,Market panic triggers emergency liquidations in Natural Gas,2026-06-13,AUGMENTED,PANIC
Academic Augmentation,Retail buyers pile into Meme coins as prices skyrocket,2026-06-13,AUGMENTED,FOMO
Academic Augmentation,Follow-the-crowd behavior causes sharp retail drawdown in Bitcoin,2026-06-13,AUGMENTED,HERD
Academic Augmentation,Investors hold onto Bitcoin despite severe 50% drawdown hoping for recovery,2026-06-13,AUGMENTED,LOSS_AVERSION
Academic Augmentation,Nasdaq markets close for the weekend after quiet trading day,2026-06-13,AUGMENTED,NEUTRAL
Google News Search,Banks raise deposit rates as stock rally accelerates cash exodus - The Korea Times,2026-05-18,HERD,HERD
Academic Augmentation,Absolute carnage in Treasury yields as selloff wipes out billions,2026-06-13,AUGMENTED,PANIC
Academic Augmentation,Capitulation: Investors dump Ethereum in absolute market rout,2026-06-13,AUGMENTED,PANIC
Academic Augmentation,"Don't miss out on the next Meme coins rally, experts warn",2026-06-13,AUGMENTED,FOMO
Google News Search,Traders bet on strait reopening as FOMO grips markets - AFR,2026-04-20,FOMO,FOMO
Academic Augmentation,Apple defies negative analyst forecasts with surprise rally,2026-06-13,AUGMENTED,COGNITIVE_DISSONANCE
Academic Augmentation,US Dollar commercial distribution rates remain at seasonal averages,2026-06-13,AUGMENTED,NEUTRAL
Academic Augmentation,Crypto markets settles at $95 on Friday afternoon trade,2026-06-13,AUGMENTED,NEUTRAL
Academic Augmentation,Frightened investors dump Nvidia in chaotic market capitulation,2026-06-13,AUGMENTED,PANIC
Google News Search,"Samsung Electronics soar on retail buying spree, strong U.S. chip stocks - 매일경제",2026-05-14,FOMO,FOMO
Google News Search,Oil closes above $100 for second day as market shrugs off U.S. measures to reduce prices during Iran war,2026-03-13,COGNITIVE_DISSONANCE,COGNITIVE_DISSONANCE
Academic Augmentation,Sheep-like panic triggers massive retail exit from Tesla,2026-06-13,AUGMENTED,HERD
Google News Search,Why Did CRVO Stock Crash 22% In Pre-Market Trading Today? - Stocktwits,2026-06-10,PANIC,PANIC
Google News Search,Bitcoin Shrugs Off Liquidity Surge as Global M2 and Fed Repo Injections Spike - CryptoRank,2026-01-01,COGNITIVE_DISSONANCE,COGNITIVE_DISSONANCE
Academic Augmentation,Exodus from US Dollar continues as investors follow the crowd,2026-06-13,AUGMENTED,HERD
Academic Augmentation,Apple markets close for the weekend after quiet trading day,2026-06-13,AUGMENTED,NEUTRAL
Academic Augmentation,Cognitive dissonance: Markets ignore Silver regulatory crackdowns,2026-06-13,AUGMENTED,COGNITIVE_DISSONANCE
Academic Augmentation,"Crypto markets shrugs off bad news, continuing its rally despite macro shock",2026-06-13,AUGMENTED,COGNITIVE_DISSONANCE
Academic Augmentation,Treasury department issues scheduled auction results for US Dollar,2026-06-13,AUGMENTED,NEUTRAL
Academic Augmentation,Local governments issue guidelines on Bitcoin resource management,2026-06-13,AUGMENTED,NEUTRAL
Academic Augmentation,S&P 500 index undergoes annual rebalancing with minimal impact,2026-06-13,AUGMENTED,NEUTRAL
Google News Search,XRP Supply Dwindles While ETFs Go On A Buying Spree Before 2026 - TradingView,2025-12-27,FOMO,FOMO
Academic Augmentation,Stubborn investors refuse to cut losses on declining Nasdaq,2026-06-13,AUGMENTED,LOSS_AVERSION
Academic Augmentation,Company executive outlines long-term strategy for Nasdaq growth,2026-06-13,AUGMENTED,NEUTRAL
Academic Augmentation,Holding S&P 500 all the way down: The psychological cost of loss aversion,2026-06-13,AUGMENTED,LOSS_AVERSION
Academic Augmentation,Factual report: AI stocks imports rise slightly in quarterly summary,2026-06-13,AUGMENTED,NEUTRAL
Academic Augmentation,Market panic triggers emergency liquidations in Tesla,2026-06-13,AUGMENTED,PANIC
Academic Augmentation,Piling into Nasdaq: The retail crowd refuses to stay on the sidelines,2026-06-13,AUGMENTED,FOMO
Academic Augmentation,Real estate prices rise despite disappointing corporate earnings report,2026-06-13,AUGMENTED,COGNITIVE_DISSONANCE
Google News Search,"While Retail Investors Flee Private Credit, Institutional Investors Stay Put - ai-cio.com",2026-06-10,HERD,HERD
Google News Search,"‘Flash Boys’ exchange IEX ramps up effort to cater to Reddit retail crowd, forms broker committee to improve stock-market structure",2021-09-23,HERD,HERD
Academic Augmentation,Piling into Bitcoin: The retail crowd refuses to stay on the sidelines,2026-06-13,AUGMENTED,FOMO
Academic Augmentation,Refusing to sell: Retail bagholders cling to Real estate despite losses,2026-06-13,AUGMENTED,LOSS_AVERSION
Academic Augmentation,Crash warning: AI stocks enters free fall as stop-losses trigger,2026-06-13,AUGMENTED,PANIC
Google News Search,Bitcoin Whales Accumulate: A Stunning 47.6K BTC Buying Spree Signals Major Market Shift - CryptoRank,2025-12-05,FOMO,FOMO
Google News Search,SpaceX tests Wall Street's 'seams' amid an unprecedented buying frenzy by funds - El Mundo America,2026-06-08,FOMO,FOMO
Academic Augmentation,Absolute carnage in Nasdaq as selloff wipes out billions,2026-06-13,AUGMENTED,PANIC
Academic Augmentation,FOMO grips investors as Gold surges to new record highs,2026-06-13,AUGMENTED,FOMO
Academic Augmentation,Market panic triggers emergency liquidations in US Dollar,2026-06-13,AUGMENTED,PANIC
Academic Augmentation,Industry conference discusses technical developments in Real estate,2026-06-13,AUGMENTED,NEUTRAL
Academic Augmentation,"Fearing they will miss the boat, retail investors flock to Nasdaq",2026-06-13,AUGMENTED,FOMO
Google News Search,"Foreign investors flee Indian assets at record pace on oil shock, pummel rupee",2026-03-27,HERD,HERD
Academic Augmentation,Treasury department issues scheduled auction results for Real estate,2026-06-13,AUGMENTED,NEUTRAL
