source,headline,date,query_source,label
Academic Augmentation,Mass retail dumping of US Dollar triggers copycat selling,2026-06-13,AUGMENTED,HERD
Academic Augmentation,Tesla prices collapse by 20% in sudden panic-driven rout,2026-06-13,AUGMENTED,PANIC
Academic Augmentation,Oil prices rise despite disappointing corporate earnings report,2026-06-13,AUGMENTED,COGNITIVE_DISSONANCE
Academic Augmentation,Capitulation: Investors dump Tesla in absolute market rout,2026-06-13,AUGMENTED,PANIC
Academic Augmentation,"Nvidia down 25%, but investors hold tight hoping to break even",2026-06-13,AUGMENTED,LOSS_AVERSION
Academic Augmentation,Natural Gas rally continues despite clear indicators of economic slowdown,2026-06-13,AUGMENTED,COGNITIVE_DISSONANCE
Academic Augmentation,Apple prices rise despite disappointing corporate earnings report,2026-06-13,AUGMENTED,COGNITIVE_DISSONANCE
Google News Search,"Bitcoin, XRP, and other crypto tokens are falling to fresh lows. Is SpaceX FOMO partly to blame? - Fast Company",2026-06-03,FOMO,FOMO
Academic Augmentation,Ethereum plunges into free fall as panic grips Wall Street,2026-06-13,AUGMENTED,PANIC
Academic Augmentation,Gold prices rise despite disappointing corporate earnings report,2026-06-13,AUGMENTED,COGNITIVE_DISSONANCE
Academic Augmentation,Plunging Ethereum prices spark widespread fear and forced selling,2026-06-13,AUGMENTED,PANIC
Google News Search,Stock masters' buying spree was concentrated on Samsung Electronics in the afternoon of the 22nd. As.. - 매일경제,2026-04-22,FOMO,FOMO
Academic Augmentation,Market panic triggers emergency liquidations in Bank stocks,2026-06-13,AUGMENTED,PANIC
Academic Augmentation,Exodus from Silver continues as investors follow the crowd,2026-06-13,AUGMENTED,HERD
Google News Search,October 2025’s blame game – Why the crypto crash was ‘game theory’ and Math in action - AMBCrypto,2026-06-11,PANIC,PANIC
Academic Augmentation,Loss aversion prevents investors from cutting ties with falling US Dollar,2026-06-13,AUGMENTED,LOSS_AVERSION
Academic Augmentation,Crash warning: Apple enters free fall as stop-losses trigger,2026-06-13,AUGMENTED,PANIC
Google News Search,Albemarle: The Drawdown Could Continue Despite Improving Lithium Supply-Demand - Seeking Alpha,2026-03-09,LOSS_AVERSION,LOSS_AVERSION
Academic Augmentation,Factual update: Crude Oil trading volume holds steady,2026-06-13,AUGMENTED,NEUTRAL
Google News Search,"Salesforce turbocharges $25 billion stock buying spree with debt, cuts cash flow guidance in half - MSN",2026-05-28,FOMO,FOMO
Academic Augmentation,Local governments issue guidelines on Oil resource management,2026-06-13,AUGMENTED,NEUTRAL
Academic Augmentation,Cognitive dissonance: Markets ignore Apple regulatory crackdowns,2026-06-13,AUGMENTED,COGNITIVE_DISSONANCE
Academic Augmentation,Ignoring warnings: Treasury yields defies negative inflation report,2026-06-13,AUGMENTED,COGNITIVE_DISSONANCE
Academic Augmentation,Analysts release quarterly revenue forecast for Apple,2026-06-13,AUGMENTED,NEUTRAL
Google News Search,India’s IPO Market Defies Long List of Concerns to Hit a Record,2025-12-09,COGNITIVE_DISSONANCE,COGNITIVE_DISSONANCE
Academic Augmentation,Statistical summary: US Dollar export volumes unchanged this month,2026-06-13,AUGMENTED,NEUTRAL
Academic Augmentation,Statistical summary: Crude Oil export volumes unchanged this month,2026-06-13,AUGMENTED,NEUTRAL
Academic Augmentation,Herd mentality takes over as crowd dumps Natural Gas holdings,2026-06-13,AUGMENTED,HERD
Google News Search,Indonesian Bonds Resume Decline as Market Confidence Stays Weak,2026-06-11,PANIC,PANIC
Academic Augmentation,Cognitive dissonance grows as investors buy Meme coins despite crash threats,2026-06-13,AUGMENTED,COGNITIVE_DISSONANCE
Google News Search,Bitcoin Declines To $101K Over Panic Selling Rally - MarketForces Africa,2025-11-06,PANIC,PANIC
Google News Search,My definition of 'bearish' is different from yours 🧸 - TKer by Sam Ro,2025-10-12,LOSS_AVERSION,LOSS_AVERSION
Google News Search,"Crypto News Today (June 11): BTC Shoots Back Above $62K, Kalshi Adds XRP Futures and Tom Lee Takes 3 Day ETH Buying Spree to $206M - 99Bitcoins",2026-06-11,FOMO,FOMO
Academic Augmentation,"Investors dismiss warnings of Meme coins correction, pushing prices higher",2026-06-13,AUGMENTED,COGNITIVE_DISSONANCE
Academic Augmentation,Loss aversion prevents investors from cutting ties with falling Real estate,2026-06-13,AUGMENTED,LOSS_AVERSION
Academic Augmentation,Panic selling spreads to retail investors flocking out of Bank stocks,2026-06-13,AUGMENTED,HERD
Academic Augmentation,Retail investors dump Silver in massive flocking exit,2026-06-13,AUGMENTED,HERD
Google News Search,Investor Outlook: Tax-loss selling season looms as investors eye TSX laggards for 2025,2025-10-08,LOSS_AVERSION,LOSS_AVERSION
Academic Augmentation,"Fearing they will miss the boat, retail investors flock to Tesla",2026-06-13,AUGMENTED,FOMO
Academic Augmentation,Sell-off accelerates in Crude Oil as fear index hits record high,2026-06-13,AUGMENTED,PANIC
Google News Search,'We've seen a wave of FOMO buying': Vermeulen on market bounce,2026-04-21,FOMO,FOMO
Academic Augmentation,Crude Oil rally continues despite clear indicators of economic slowdown,2026-06-13,AUGMENTED,COGNITIVE_DISSONANCE
Google News Search,The Canadian Stock I Simply Refuse to Sell,2026-04-06,LOSS_AVERSION,LOSS_AVERSION
Google News Search,Minbos submits first drawdown request under US$16 million IDC facility - Proactive financial news,2026-05-26,LOSS_AVERSION,LOSS_AVERSION
Academic Augmentation,Factual update: S&P 500 trading volume holds steady,2026-06-13,AUGMENTED,NEUTRAL
Google News Search,"Bitcoin Price Prediction: Not Just ETFs, Corporate BTC Buying Spree Has Collapsed - Cryptonews",2026-06-11,FOMO,FOMO
Academic Augmentation,New regulatory guidelines issued for Apple market participants,2026-06-13,AUGMENTED,NEUTRAL
Google News Search,Forget FOMO – Yardeni Says ‘Fabulous Earnings Momentum’ Is Powering US Stocks - Stocktwits,2026-05-28,FOMO,FOMO
Google News Search,Chelsea unwilling to sell Cole Palmer amid Manchester United links - TheHardTackle.com,2026-01-25,LOSS_AVERSION,LOSS_AVERSION
Google News Search,"Why is Crypto Up? Bitcoin Reclaims $71,000 as Market Shrugs Off Middle East Escalation - Cryptonews",2026-03-04,COGNITIVE_DISSONANCE,COGNITIVE_DISSONANCE
Academic Augmentation,Plunging Meme coins prices spark widespread fear and forced selling,2026-06-13,AUGMENTED,PANIC
Academic Augmentation,Holding Bank stocks all the way down: The psychological cost of loss aversion,2026-06-13,AUGMENTED,LOSS_AVERSION
Academic Augmentation,"Tech stocks down 12%, but investors hold tight hoping to break even",2026-06-13,AUGMENTED,LOSS_AVERSION
Academic Augmentation,Tesla plunges into free fall as panic grips Wall Street,2026-06-13,AUGMENTED,PANIC
Academic Augmentation,Flocking to exit: Why everyone is selling their Oil today,2026-06-13,AUGMENTED,HERD
Google News Search,"Exodus, Ondo launch tokenized markets with 200-plus stocks and ETFs on Solana - The Block",2026-06-12,HERD,HERD
Google News Search,Santiment Warns FOMO Could Return if Bitcoin Hits $92K - TradingView,2026-01-03,FOMO,FOMO
Academic Augmentation,Academic research paper reviews long-term utility of Meme coins,2026-06-13,AUGMENTED,NEUTRAL
Academic Augmentation,Retail mania driving AI stocks parabolic as latecomers jump in,2026-06-13,AUGMENTED,FOMO
Google News Search,History Suggests the Market Could Crash in 2026: Here's How You Can Protect Your Portfolio Right Now,2026-05-25,PANIC,PANIC
Academic Augmentation,Cognitive dissonance grows as investors buy Nvidia despite crash threats,2026-06-13,AUGMENTED,COGNITIVE_DISSONANCE
Academic Augmentation,Why the market is ignoring bad news and buying Apple anyway,2026-06-13,AUGMENTED,COGNITIVE_DISSONANCE
Google News Search,Oil tanker owners fear market crash after Iran war drove record profits - Financial Times,2026-06-06,PANIC,PANIC
Academic Augmentation,Panic selling spreads to retail investors flocking out of US Dollar,2026-06-13,AUGMENTED,HERD
Google News Search,Bitmine Plans 9.5% Preferred Stock Plan to Fuel Its Ethereum Buying Spree - CryptoRank,2026-06-07,FOMO,FOMO
Academic Augmentation,Flocking to exit: Why everyone is selling their S&P 500 today,2026-06-13,AUGMENTED,HERD
Academic Augmentation,Crash warning: Treasury yields enters free fall as stop-losses trigger,2026-06-13,AUGMENTED,PANIC
Academic Augmentation,"Bitcoin markets remain blind to risk, extending rally on bad news",2026-06-13,AUGMENTED,COGNITIVE_DISSONANCE
Google News Search,Ripple ETFs Defy Mass Exodus Trend but XRP Price Fails to Capitalize - CryptoPotato,2026-05-24,HERD,HERD
Academic Augmentation,Loss aversion keeps investors trapped in losing Tech stocks positions,2026-06-13,AUGMENTED,LOSS_AVERSION
Academic Augmentation,Investors hold onto Crude Oil despite severe 12% drawdown hoping for recovery,2026-06-13,AUGMENTED,LOSS_AVERSION
Academic Augmentation,"Investors herd into cash, selling off US Dollar positions in unison",2026-06-13,AUGMENTED,HERD
Academic Augmentation,Loss aversion keeps investors trapped in losing S&P 500 positions,2026-06-13,AUGMENTED,LOSS_AVERSION
Academic Augmentation,Retail mania driving Nvidia parabolic as latecomers jump in,2026-06-13,AUGMENTED,FOMO
Academic Augmentation,Retail investors dump Bank stocks in massive flocking exit,2026-06-13,AUGMENTED,HERD
Academic Augmentation,Industry conference discusses technical developments in Apple,2026-06-13,AUGMENTED,NEUTRAL
Academic Augmentation,Refusing to sell: Retail bagholders cling to Tech stocks despite losses,2026-06-13,AUGMENTED,LOSS_AVERSION
Academic Augmentation,Industry conference discusses technical developments in Crude Oil,2026-06-13,AUGMENTED,NEUTRAL
Academic Augmentation,"Severe Oil sell-off triggers circuit breakers, prices crash",2026-06-13,AUGMENTED,PANIC
Academic Augmentation,Oil markets close for the weekend after quiet trading day,2026-06-13,AUGMENTED,NEUTRAL
Academic Augmentation,Tech stocks plunges into free fall as panic grips Wall Street,2026-06-13,AUGMENTED,PANIC
Academic Augmentation,"Silver down 10%, but investors hold tight hoping to break even",2026-06-13,AUGMENTED,LOSS_AVERSION
Academic Augmentation,Stubborn retail holding keeps S&P 500 positions active despite deep red,2026-06-13,AUGMENTED,LOSS_AVERSION
Academic Augmentation,Follow the leader: Retail crowd copies institutional exit from Ethereum,2026-06-13,AUGMENTED,HERD
Academic Augmentation,Oil processing plants operate within normal parameters,2026-06-13,AUGMENTED,NEUTRAL
Google News Search,A FOMO Moment for Mythos - The New York Times,2026-05-19,FOMO,FOMO
Academic Augmentation,Economists publish revised baseline outlook for Tech stocks markets,2026-06-13,AUGMENTED,NEUTRAL
Google News Search,White House Shrugs Off Shaky Economy as War Exceeds Trump’s Timeline - The New York Times,2026-04-16,COGNITIVE_DISSONANCE,COGNITIVE_DISSONANCE
Academic Augmentation,Investors flee Real estate as market crowd moves to cash,2026-06-13,AUGMENTED,HERD
Google News Search,Crypto wallet provider Exodus reports wider Q1 loss as revenue falls 37% - The Block,2026-05-12,HERD,HERD
Academic Augmentation,"Everyone is selling Crude Oil, causing retail panic herd",2026-06-13,AUGMENTED,HERD
Google News Search,Crypto traders spend $9.7B on fees as the next Bitcoin drawdown will expose which on-chain costs are real - CryptoSlate,2026-04-19,LOSS_AVERSION,LOSS_AVERSION
Academic Augmentation,Speculators buy Treasury yields at all-time highs fearing further gains,2026-06-13,AUGMENTED,FOMO
Google News Search,BDC Exodus: Investors Pull More Cash Than They Put In For The First Time - Benzinga,2026-05-15,HERD,HERD
Google News Search,"Metaplanet Raises $255 Million, Eyes $531 Million Bitcoin Buying Spree - Bitcoin Magazine",2026-03-16,FOMO,FOMO
Academic Augmentation,Tech stocks defies negative analyst forecasts with surprise rally,2026-06-13,AUGMENTED,COGNITIVE_DISSONANCE
Academic Augmentation,Factual update: Tech stocks trading volume holds steady,2026-06-13,AUGMENTED,NEUTRAL
Google News Search,"S&P 500 Hits Record on FOMO Rally, Barclays Warns - Gotrade",2026-04-17,FOMO,FOMO
Academic Augmentation,Reluctance to take losses leads to stagnation in retail Natural Gas portfolios,2026-06-13,AUGMENTED,LOSS_AVERSION
Academic Augmentation,Psychology of the bagholder: Refusing to sell Nvidia at a loss,2026-06-13,AUGMENTED,LOSS_AVERSION
Academic Augmentation,Defying gravity: Meme coins shrugs off geopolitical tension and rises,2026-06-13,AUGMENTED,COGNITIVE_DISSONANCE
Academic Augmentation,Retail stores report steady supply of US Dollar products,2026-06-13,AUGMENTED,NEUTRAL
Academic Augmentation,Real estate price surges even as regulatory warning signals emerge,2026-06-13,AUGMENTED,COGNITIVE_DISSONANCE
Academic Augmentation,Follow the leader: Retail crowd copies institutional exit from S&P 500,2026-06-13,AUGMENTED,HERD
Google News Search,Bitcoin's drawdown hit 50%. History shows it may have further to go,2026-02-12,LOSS_AVERSION,LOSS_AVERSION
Academic Augmentation,Market shrugs off Crude Oil supply issues as speculation continues,2026-06-13,AUGMENTED,COGNITIVE_DISSONANCE
Academic Augmentation,FOMO grips investors as Meme coins surges to new record highs,2026-06-13,AUGMENTED,FOMO
Academic Augmentation,Nvidia defies negative analyst forecasts with surprise rally,2026-06-13,AUGMENTED,COGNITIVE_DISSONANCE
Academic Augmentation,Factual update: Oil trading volume holds steady,2026-06-13,AUGMENTED,NEUTRAL
Academic Augmentation,Holding losing bags: Why retail won't lock in Bitcoin losses,2026-06-13,AUGMENTED,LOSS_AVERSION
Google News Search,Oracle’s 20% Plunge Proves What Micron Knew All Along: AI Demand Is About to Collapse - 24/7 Wall St.,2026-06-11,PANIC,PANIC
Academic Augmentation,Loss aversion rules: Traders double down on losing Meme coins trades,2026-06-13,AUGMENTED,LOSS_AVERSION
Academic Augmentation,"Retail traders hold Nasdaq bags, refusing to realize paper losses",2026-06-13,AUGMENTED,LOSS_AVERSION
Academic Augmentation,Company executive outlines long-term strategy for Ethereum growth,2026-06-13,AUGMENTED,NEUTRAL
Academic Augmentation,Tech stocks price surges even as regulatory warning signals emerge,2026-06-13,AUGMENTED,COGNITIVE_DISSONANCE
Google News Search,Bitcoin shrugs off CLARITY Act delay by rallying above $93K - TradingView,2026-01-13,COGNITIVE_DISSONANCE,COGNITIVE_DISSONANCE
Google News Search,"Foreign capital accelerates buying spree, with China's mainland stock market attracting RMB 200 billion in April - 富途牛牛",2026-05-20,FOMO,FOMO
Academic Augmentation,Piling into Natural Gas: The retail crowd refuses to stay on the sidelines,2026-06-13,AUGMENTED,FOMO
Google News Search,Imperial Brands shrugs off lower cigarette volumes - Investors' Chronicle,2025-11-18,COGNITIVE_DISSONANCE,COGNITIVE_DISSONANCE
Academic Augmentation,Economists publish revised baseline outlook for Silver markets,2026-06-13,AUGMENTED,NEUTRAL
Google News Search,"Crypto Market Crash Alert: Bitcoin Risks Falling to $75K, Will Ethereum & XRP Follow?",2026-05-22,PANIC,PANIC
Academic Augmentation,Panic selling grips Crude Oil as market crashes suddenly,2026-06-13,AUGMENTED,PANIC
Academic Augmentation,Panic selling spreads to retail investors flocking out of Real estate,2026-06-13,AUGMENTED,HERD
Academic Augmentation,Psychology of the bagholder: Refusing to sell Treasury yields at a loss,2026-06-13,AUGMENTED,LOSS_AVERSION
Google News Search,Above the Noise: FOMO isn’t about ignoring risk - invesco.com,2026-04-28,FOMO,FOMO
Academic Augmentation,Loss aversion prevents investors from cutting ties with falling Natural Gas,2026-06-13,AUGMENTED,LOSS_AVERSION
Academic Augmentation,Public interest in Bitcoin spikes as retail buyers chase momentum,2026-06-13,AUGMENTED,FOMO
Google News Search,"BT Opening Bell | Sensex plunges 452 pts, Nifty below 23,250; IT stocks defy weak market trend - Business Today",2026-06-02,COGNITIVE_DISSONANCE,COGNITIVE_DISSONANCE
Academic Augmentation,FOMO grips investors as Crypto markets surges to new record highs,2026-06-13,AUGMENTED,FOMO
Academic Augmentation,Meme coins prices collapse by 50% in sudden panic-driven rout,2026-06-13,AUGMENTED,PANIC
Google News Search,Michael Burry Reveals Major PayPal (PYPL) Position Amid Software Stock Buying Spree - MEXC Exchange,2026-04-17,FOMO,FOMO
Google News Search,BTC Crowd Flips From Extreme Pessimism to Ultra FOMO as Price Nears $80K - CryptoPotato,2026-04-24,FOMO,FOMO
Google News Search,Tech Bytes: TechnologyOne shrugs off earnings wobble as AI ambitions drive SaaS momentum - Proactive financial news,2026-05-20,COGNITIVE_DISSONANCE,COGNITIVE_DISSONANCE
Academic Augmentation,Oil defies negative analyst forecasts with surprise rally,2026-06-13,AUGMENTED,COGNITIVE_DISSONANCE
Academic Augmentation,Panic selling grips Silver as market crashes suddenly,2026-06-13,AUGMENTED,PANIC
Google News Search,Michael Saylor Predicts Bitcoin ‘Supply Shock’ Amid MSTR’s Buying Spree – Sees ‘Cambrian’ Explosion Ahead - Stocktwits,2026-04-28,FOMO,FOMO
Academic Augmentation,Widespread panic triggers margin calls and liquidation of Bank stocks,2026-06-13,AUGMENTED,PANIC
Academic Augmentation,Fear of missing out drives massive retail inflow into Crypto markets,2026-06-13,AUGMENTED,FOMO
Google News Search,Breakingviews - SpaceX index thrust preys on market FOMO,2026-02-13,FOMO,FOMO
Academic Augmentation,Follow the leader: Retail crowd copies institutional exit from Real estate,2026-06-13,AUGMENTED,HERD
Academic Augmentation,Natural Gas prices rise despite disappointing corporate earnings report,2026-06-13,AUGMENTED,COGNITIVE_DISSONANCE
Academic Augmentation,Cognitive dissonance grows as investors buy Bank stocks despite crash threats,2026-06-13,AUGMENTED,COGNITIVE_DISSONANCE
Academic Augmentation,Exodus from Bank stocks funds gathers steam amid widespread pessimism,2026-06-13,AUGMENTED,HERD
Google News Search,Tawhid Crypto Insight(@suplexBTC)'s insights - Binance,2026-06-07,FOMO,FOMO
Google News Search,Ethereum Whales on Buying Spree As Crypto Market Pulls Back - Decrypt,2025-11-12,FOMO,FOMO
Google News Search,Unstoppable Retail Crowd Breaks Stock Buying Record Despite Rout,2025-02-06,HERD,HERD
Academic Augmentation,Buying frenzy pushes Bitcoin to unsustainable levels,2026-06-13,AUGMENTED,FOMO
Academic Augmentation,Investors flee Bank stocks as market crowd moves to cash,2026-06-13,AUGMENTED,HERD
Academic Augmentation,AI stocks processing plants operate within normal parameters,2026-06-13,AUGMENTED,NEUTRAL
Academic Augmentation,Analysts release quarterly revenue forecast for Real estate,2026-06-13,AUGMENTED,NEUTRAL
Google News Search,"Bank of America Fund Manager Survey: Stock Market Mania Subsides, the Biggest Risk Has Changed! - Bitget",2026-03-17,FOMO,FOMO
Google News Search,"Silver faces sixth year of deficit with stock drawdown raising squeeze risks, research shows",2026-04-15,LOSS_AVERSION,LOSS_AVERSION
Academic Augmentation,Nasdaq prices rise despite disappointing corporate earnings report,2026-06-13,AUGMENTED,COGNITIVE_DISSONANCE
Academic Augmentation,Defying gravity: Ethereum shrugs off geopolitical tension and rises,2026-06-13,AUGMENTED,COGNITIVE_DISSONANCE
Academic Augmentation,Academic research paper reviews long-term utility of Ethereum,2026-06-13,AUGMENTED,NEUTRAL
Academic Augmentation,Investors flee Tesla as market crowd moves to cash,2026-06-13,AUGMENTED,HERD
Academic Augmentation,Sell-off accelerates in Nasdaq as fear index hits record high,2026-06-13,AUGMENTED,PANIC
Academic Augmentation,Fear of missing out drives massive retail inflow into Gold,2026-06-13,AUGMENTED,FOMO
Academic Augmentation,"Everyone is selling Treasury yields, causing retail panic herd",2026-06-13,AUGMENTED,HERD
Academic Augmentation,Gold market crashes as investors capitulate in panic,2026-06-13,AUGMENTED,PANIC
Academic Augmentation,Flocking to exit: Why everyone is selling their Bitcoin today,2026-06-13,AUGMENTED,HERD
Academic Augmentation,Crude Oil prices rise despite disappointing corporate earnings report,2026-06-13,AUGMENTED,COGNITIVE_DISSONANCE
Academic Augmentation,Cognitive dissonance: Markets ignore Nvidia regulatory crackdowns,2026-06-13,AUGMENTED,COGNITIVE_DISSONANCE
Google News Search,"Exodus (EXOD) dumps 1,000 bitcoin (BTC): Why the crypto wallet is cashing out to fund a payments empire",2026-05-12,HERD,HERD
Google News Search,Is Michael Saylor’s Bitcoin Buying Spree About To Pause? - CoinGape,2026-04-22,FOMO,FOMO
Google News Search,Wall Street shrugs off shutdown threat as S&P 500 heads for fifth straight winning month - Fortune,2025-09-30,COGNITIVE_DISSONANCE,COGNITIVE_DISSONANCE
Academic Augmentation,Exodus from Treasury yields continues as investors follow the crowd,2026-06-13,AUGMENTED,HERD
Academic Augmentation,Holding losing bags: Why retail won't lock in Ethereum losses,2026-06-13,AUGMENTED,LOSS_AVERSION
Academic Augmentation,Retail buyers pile into US Dollar as prices skyrocket,2026-06-13,AUGMENTED,FOMO
Academic Augmentation,Market shrugs off S&P 500 supply issues as speculation continues,2026-06-13,AUGMENTED,COGNITIVE_DISSONANCE
Google News Search,Investors warn of ‘correction’ risk as high-flying stocks defy bond gloom - Financial Times,2026-05-19,COGNITIVE_DISSONANCE,COGNITIVE_DISSONANCE
Academic Augmentation,Investors flee Crude Oil as market crowd moves to cash,2026-06-13,AUGMENTED,HERD
Academic Augmentation,Frenzy in Tech stocks options market as traders bet on massive rally,2026-06-13,AUGMENTED,FOMO
Google News Search,"Don't panic yet, investors say, as high-flying AI stocks tumble",2025-11-05,PANIC,PANIC
Academic Augmentation,Panic selling spreads to retail investors flocking out of Natural Gas,2026-06-13,AUGMENTED,HERD
Google News Search,Whales stage biggest BTC buying spree since 2013 - CryptoRank,2026-04-21,FOMO,FOMO
Academic Augmentation,Widespread panic triggers margin calls and liquidation of Tech stocks,2026-06-13,AUGMENTED,PANIC
Google News Search,Why the stock market keeps shrugging as Trump sows more political chaos,2026-01-14,COGNITIVE_DISSONANCE,COGNITIVE_DISSONANCE
Academic Augmentation,Bloodbath in Treasury yields market as prices plunge 30%,2026-06-13,AUGMENTED,PANIC
Academic Augmentation,Why the market is ignoring bad news and buying Tech stocks anyway,2026-06-13,AUGMENTED,COGNITIVE_DISSONANCE
Academic Augmentation,Defying gravity: Treasury yields shrugs off geopolitical tension and rises,2026-06-13,AUGMENTED,COGNITIVE_DISSONANCE
Academic Augmentation,Plunging Crypto markets prices spark widespread fear and forced selling,2026-06-13,AUGMENTED,PANIC
Academic Augmentation,Holding losing bags: Why retail won't lock in Treasury yields losses,2026-06-13,AUGMENTED,LOSS_AVERSION
Academic Augmentation,Ignoring the red flags: Retail buyers bid up Treasury yields despite risks,2026-06-13,AUGMENTED,COGNITIVE_DISSONANCE
Academic Augmentation,Nasdaq price surges even as regulatory warning signals emerge,2026-06-13,AUGMENTED,COGNITIVE_DISSONANCE
Google News Search,"Traders pile into call options as fear of missing out grows, according to Cboe",2026-04-21,FOMO,FOMO
Academic Augmentation,Herd mentality takes over as crowd dumps Treasury yields holdings,2026-06-13,AUGMENTED,HERD
Academic Augmentation,New regulatory guidelines issued for US Dollar market participants,2026-06-13,AUGMENTED,NEUTRAL
Academic Augmentation,New regulatory guidelines issued for Bitcoin market participants,2026-06-13,AUGMENTED,NEUTRAL
Academic Augmentation,New study evaluates historical performance trends of Real estate,2026-06-13,AUGMENTED,NEUTRAL
Google News Search,Private Equity Accelerates REIT Buying Spree as Discounts Create Opportunity - citybiz,2026-05-19,FOMO,FOMO
Google News Search,Bitcoin-Backed Mortgages Launched for Crypto Millionaires - CoinMarketCap,2023-09-24,LOSS_AVERSION,LOSS_AVERSION
Academic Augmentation,Ignoring warnings: Ethereum defies negative inflation report,2026-06-13,AUGMENTED,COGNITIVE_DISSONANCE
Academic Augmentation,Investors flee US Dollar as market crowd moves to cash,2026-06-13,AUGMENTED,HERD
Academic Augmentation,Retail investors dump Treasury yields in massive flocking exit,2026-06-13,AUGMENTED,HERD
Academic Augmentation,Retail crowd scrambles to dump Real estate as sell-off intensifies,2026-06-13,AUGMENTED,HERD
Academic Augmentation,Herd mentality takes over as crowd dumps Meme coins holdings,2026-06-13,AUGMENTED,HERD
Academic Augmentation,Analysts release quarterly revenue forecast for Tesla,2026-06-13,AUGMENTED,NEUTRAL
Academic Augmentation,Company executive outlines long-term strategy for Meme coins growth,2026-06-13,AUGMENTED,NEUTRAL
Academic Augmentation,Exodus from Apple funds gathers steam amid widespread pessimism,2026-06-13,AUGMENTED,HERD
Google News Search,European stocks rebound from selloff driven by war fears; Spain shrugs off US threats - The Business Times,2026-03-05,COGNITIVE_DISSONANCE,COGNITIVE_DISSONANCE
Academic Augmentation,Stubborn investors refuse to cut losses on declining Treasury yields,2026-06-13,AUGMENTED,LOSS_AVERSION
Academic Augmentation,Investors chase the Gold rally despite warnings of a bubble,2026-06-13,AUGMENTED,FOMO
Google News Search,Bitcoin hashrate drops 12% in worst drawdown since China mining ban: CryptoQuant,2026-01-31,LOSS_AVERSION,LOSS_AVERSION
Google News Search,The Big Picture: Why Wall Street's Bitcoin Bet Is More Than Just Speculation - Kavout,2025-11-26,PANIC,PANIC
Academic Augmentation,S&P 500 price surges even as regulatory warning signals emerge,2026-06-13,AUGMENTED,COGNITIVE_DISSONANCE
Google News Search,Meta: Reiterating Strong Buy After The Post-Earnings Drawdown - Seeking Alpha,2026-05-12,LOSS_AVERSION,LOSS_AVERSION
Academic Augmentation,Late-stage FOMO drives massive surge in Nasdaq trading activity,2026-06-13,AUGMENTED,FOMO
Academic Augmentation,Meme coins index undergoes annual rebalancing with minimal impact,2026-06-13,AUGMENTED,NEUTRAL
Google News Search,Is Elon Musk Giving Index Funds FOMO?,2026-02-06,FOMO,FOMO
