source,headline,date,query_source,label
Academic Augmentation,Standard contract updates finalized for Nasdaq futures traders,2026-06-13,AUGMENTED,NEUTRAL
Academic Augmentation,Holding Meme coins all the way down: The psychological cost of loss aversion,2026-06-13,AUGMENTED,LOSS_AVERSION
Google News Search,Hedera (HBAR) Drops 4.8% Amid Broad Crypto Market Drawdown - CoinMarketCap,2026-05-23,LOSS_AVERSION,LOSS_AVERSION
Academic Augmentation,AI stocks settles at $450 on Thursday afternoon trade,2026-06-13,AUGMENTED,NEUTRAL
Academic Augmentation,Nasdaq rally continues despite clear indicators of economic slowdown,2026-06-13,AUGMENTED,COGNITIVE_DISSONANCE
Google News Search,HYPE Price Jumps 17% as Hyperliquid-Powered Fomo Launch Fuels Trading Frenzy - Coinpedia,2026-06-12,FOMO,FOMO
Academic Augmentation,Exodus from Tech stocks funds gathers steam amid widespread pessimism,2026-06-13,AUGMENTED,HERD
Academic Augmentation,Investors flee Silver as market crowd moves to cash,2026-06-13,AUGMENTED,HERD
Academic Augmentation,Piling into Real estate: The retail crowd refuses to stay on the sidelines,2026-06-13,AUGMENTED,FOMO
Academic Augmentation,Bloodbath in Nvidia market as prices plunge 15%,2026-06-13,AUGMENTED,PANIC
Academic Augmentation,Bank stocks prices rise despite disappointing corporate earnings report,2026-06-13,AUGMENTED,COGNITIVE_DISSONANCE
Academic Augmentation,"Don't miss out on the next Gold rally, experts warn",2026-06-13,AUGMENTED,FOMO
Google News Search,"Aussie retailer taking on IKEA, Harvey Norman cops brutal $1.4 billion hit",2026-02-12,COGNITIVE_DISSONANCE,COGNITIVE_DISSONANCE
Academic Augmentation,Treasury department issues scheduled auction results for Apple,2026-06-13,AUGMENTED,NEUTRAL
Google News Search,Market liquidity concerns cloud end of Fed's balance sheet drawdown,2025-10-28,LOSS_AVERSION,LOSS_AVERSION
Academic Augmentation,Widespread panic triggers margin calls and liquidation of Meme coins,2026-06-13,AUGMENTED,PANIC
Google News Search,Can we finally stop worrying about the stock market crash and start having fun?,2026-05-25,PANIC,PANIC
Academic Augmentation,Follow-the-crowd behavior causes sharp retail drawdown in Crude Oil,2026-06-13,AUGMENTED,HERD
Google News Search,"US adds 115,000 jobs in April as labour market shrugs off energy shock - Financial Times",2026-05-08,COGNITIVE_DISSONANCE,COGNITIVE_DISSONANCE
Academic Augmentation,Crowd dynamics take over as investors simultaneously dump Tesla,2026-06-13,AUGMENTED,HERD
Academic Augmentation,Market shrugs off Nvidia supply issues as speculation continues,2026-06-13,AUGMENTED,COGNITIVE_DISSONANCE
Academic Augmentation,Hoping for a rebound: Investors refuse to exit their losing Real estate bets,2026-06-13,AUGMENTED,LOSS_AVERSION
Academic Augmentation,Widespread panic triggers margin calls and liquidation of S&P 500,2026-06-13,AUGMENTED,PANIC
Google News Search,USDA's June WASDE Report Sparks Grain Market Rout: Corn Crashes to New Lows as Traders Find No Bullish Surprises - Hoosier Ag Today,2026-06-12,PANIC,PANIC
Academic Augmentation,"Investors herd into cash, selling off Meme coins positions in unison",2026-06-13,AUGMENTED,HERD
Academic Augmentation,"Investors herd into cash, selling off Apple positions in unison",2026-06-13,AUGMENTED,HERD
Academic Augmentation,Retail buyers pile into Bitcoin as prices skyrocket,2026-06-13,AUGMENTED,FOMO
Academic Augmentation,Bank stocks prices collapse by 25% in sudden panic-driven rout,2026-06-13,AUGMENTED,PANIC
Google News Search,UK investors flock to buy into Ghana’s lucrative property market - The Business & Financial Times,2023-11-28,HERD,HERD
Academic Augmentation,Retail crowd scrambles to dump Apple as sell-off intensifies,2026-06-13,AUGMENTED,HERD
Google News Search,Ethereum bulls fight ‘conviction crisis’ – THESE 3 indicators suggest more drawdown - AMBCrypto,2026-02-17,LOSS_AVERSION,LOSS_AVERSION
Academic Augmentation,Hoping for a rebound: Investors refuse to exit their losing Apple bets,2026-06-13,AUGMENTED,LOSS_AVERSION
Academic Augmentation,Exodus from Ethereum continues as investors follow the crowd,2026-06-13,AUGMENTED,HERD
Academic Augmentation,Meme coins price fluctuates within narrow range during morning session,2026-06-13,AUGMENTED,NEUTRAL
Academic Augmentation,Natural Gas defies negative analyst forecasts with surprise rally,2026-06-13,AUGMENTED,COGNITIVE_DISSONANCE
Academic Augmentation,Ignoring warnings: Nvidia defies negative inflation report,2026-06-13,AUGMENTED,COGNITIVE_DISSONANCE
Google News Search,A loan against your CD might be one option for quick cash. Here are the pros and cons,2020-04-27,LOSS_AVERSION,LOSS_AVERSION
Academic Augmentation,"Severe S&P 500 sell-off triggers circuit breakers, prices crash",2026-06-13,AUGMENTED,PANIC
Academic Augmentation,Sell-off accelerates in Nvidia as fear index hits record high,2026-06-13,AUGMENTED,PANIC
Academic Augmentation,Retail traders trigger short squeeze in Ethereum as FOMO peaks,2026-06-13,AUGMENTED,FOMO
Google News Search,FT: Silver’s runaway rally becomes ‘death trap’ for Reddit’s retail crowd - BizNews,2026-02-03,HERD,HERD
Google News Search,Bitcoin News: Bitcoin Bear Market 2024: Is a 47% Drawdown Really The End? Historical Data Says No - Binance,2026-03-02,LOSS_AVERSION,LOSS_AVERSION
Academic Augmentation,Annual meeting of Meme coins trade association scheduled for Q3,2026-06-13,AUGMENTED,NEUTRAL
Academic Augmentation,Retail mania driving Nasdaq parabolic as latecomers jump in,2026-06-13,AUGMENTED,FOMO
Academic Augmentation,US Dollar prices collapse by 50% in sudden panic-driven rout,2026-06-13,AUGMENTED,PANIC
Academic Augmentation,Herd mentality takes over as crowd dumps Silver holdings,2026-06-13,AUGMENTED,HERD
Academic Augmentation,Sheep-like panic triggers massive retail exit from S&P 500,2026-06-13,AUGMENTED,HERD
Academic Augmentation,Reluctance to take losses leads to stagnation in retail US Dollar portfolios,2026-06-13,AUGMENTED,LOSS_AVERSION
Academic Augmentation,Sell-off accelerates in US Dollar as fear index hits record high,2026-06-13,AUGMENTED,PANIC
Academic Augmentation,Plunging Tesla prices spark widespread fear and forced selling,2026-06-13,AUGMENTED,PANIC
Academic Augmentation,Panic selling spreads to retail investors flocking out of Gold,2026-06-13,AUGMENTED,HERD
Academic Augmentation,"Investors herd into cash, selling off Real estate positions in unison",2026-06-13,AUGMENTED,HERD
Academic Augmentation,Treasury department issues scheduled auction results for Treasury yields,2026-06-13,AUGMENTED,NEUTRAL
Academic Augmentation,Crypto markets index undergoes annual rebalancing with minimal impact,2026-06-13,AUGMENTED,NEUTRAL
Academic Augmentation,Investors hold onto Crypto markets despite severe 50% drawdown hoping for recovery,2026-06-13,AUGMENTED,LOSS_AVERSION
Google News Search,"Bridgewater China backs Chinese equities, gold after March fund drawdown",2026-04-20,LOSS_AVERSION,LOSS_AVERSION
Google News Search,"Tom Lee Shrugs Off ETH Sell-Off, Says Fundamentals Don’t Match Falling Prices - CryptoPotato",2026-02-03,COGNITIVE_DISSONANCE,COGNITIVE_DISSONANCE
Academic Augmentation,Treasury department issues scheduled auction results for Bitcoin,2026-06-13,AUGMENTED,NEUTRAL
Academic Augmentation,Reluctance to take losses leads to stagnation in retail Tesla portfolios,2026-06-13,AUGMENTED,LOSS_AVERSION
Academic Augmentation,Holding losing bags: Why retail won't lock in Natural Gas losses,2026-06-13,AUGMENTED,LOSS_AVERSION
Academic Augmentation,Retail stores report steady supply of Apple products,2026-06-13,AUGMENTED,NEUTRAL
Academic Augmentation,Bank stocks price fluctuates within narrow range during morning session,2026-06-13,AUGMENTED,NEUTRAL
Google News Search,Bologna unwilling to sell Emil Holm amid Everton links - TheHardTackle.com,2026-01-13,LOSS_AVERSION,LOSS_AVERSION
Academic Augmentation,Psychology of the bagholder: Refusing to sell Ethereum at a loss,2026-06-13,AUGMENTED,LOSS_AVERSION
Academic Augmentation,Psychology of the bagholder: Refusing to sell Nasdaq at a loss,2026-06-13,AUGMENTED,LOSS_AVERSION
Google News Search,Stock Market Shrugs Off War - Electronics Weekly,2026-04-28,COGNITIVE_DISSONANCE,COGNITIVE_DISSONANCE
Google News Search,Revealed: Here’s the Only Canadian Stock I’d Refuse to Sell,2026-05-01,LOSS_AVERSION,LOSS_AVERSION
Academic Augmentation,"Investors dismiss warnings of Silver correction, pushing prices higher",2026-06-13,AUGMENTED,COGNITIVE_DISSONANCE
Academic Augmentation,"Retail traders hold Nvidia bags, refusing to realize paper losses",2026-06-13,AUGMENTED,LOSS_AVERSION
Academic Augmentation,Retail stores report steady supply of S&P 500 products,2026-06-13,AUGMENTED,NEUTRAL
Academic Augmentation,Crypto markets markets close for the weekend after quiet trading day,2026-06-13,AUGMENTED,NEUTRAL
Academic Augmentation,Stubborn retail holding keeps Oil positions active despite deep red,2026-06-13,AUGMENTED,LOSS_AVERSION
Academic Augmentation,Frightened investors dump Bitcoin in chaotic market capitulation,2026-06-13,AUGMENTED,PANIC
Academic Augmentation,"Don't miss out on the next Natural Gas rally, experts warn",2026-06-13,AUGMENTED,FOMO
Google News Search,"Crypto Market Collapse Risk: Panic Selling Tests Bitcoin, ETH, XRP, SOL",2025-10-17,PANIC,PANIC
Academic Augmentation,Nvidia plunges into free fall as panic grips Wall Street,2026-06-13,AUGMENTED,PANIC
Google News Search,Blackstone Shrugs off Private Credit Concerns amid AI Focus,2026-04-23,COGNITIVE_DISSONANCE,COGNITIVE_DISSONANCE
Google News Search,‘Safe haven’: Wealthy Americans flock to buy their way into NZ - Stuff,2025-09-01,HERD,HERD
Academic Augmentation,Tech stocks commercial distribution rates remain at seasonal averages,2026-06-13,AUGMENTED,NEUTRAL
Academic Augmentation,US Dollar prices rise despite disappointing corporate earnings report,2026-06-13,AUGMENTED,COGNITIVE_DISSONANCE
Academic Augmentation,Late-stage FOMO drives massive surge in Crypto markets trading activity,2026-06-13,AUGMENTED,FOMO
Google News Search,Elon Musk’s $2-trillion SpaceX IPO tests how far investors will go for FOMO - Los Angeles Times,2026-05-18,FOMO,FOMO
Academic Augmentation,Bloodbath in Bank stocks market as prices plunge 15%,2026-06-13,AUGMENTED,PANIC
Google News Search,Three signs that Bitcoin price could be near ‘full capitulation’ - TradingView,2026-02-05,PANIC,PANIC
Google News Search,Why Redwire Stock Crashed Today - The Motley Fool,2026-06-12,PANIC,PANIC
Academic Augmentation,Absolute carnage in Tesla as selloff wipes out billions,2026-06-13,AUGMENTED,PANIC
Academic Augmentation,"Retail traders hold Treasury yields bags, refusing to realize paper losses",2026-06-13,AUGMENTED,LOSS_AVERSION
Google News Search,"Catalio Capital Shrugs Off Sluggish Market, Tops $400 Million for Life-Sciences Fund",2025-07-01,COGNITIVE_DISSONANCE,COGNITIVE_DISSONANCE
Google News Search,"Fulham fail with £20 million bid to sign Joe Willock, Newcastle United unwilling to sell - TheHardTackle.com",2026-02-01,LOSS_AVERSION,LOSS_AVERSION
Google News Search,"Crypto market analysis: New bull market may be about to begin, says Owen Lau",2026-03-04,LOSS_AVERSION,LOSS_AVERSION
Google News Search,Exodus Markets Brings 200+ Tokenized Stocks and ETFs to Solana Blockchain - Blockonomi,2026-06-13,HERD,HERD
Academic Augmentation,New regulatory guidelines issued for Real estate market participants,2026-06-13,AUGMENTED,NEUTRAL
Academic Augmentation,Fear of missing out drives massive retail inflow into Real estate,2026-06-13,AUGMENTED,FOMO
Academic Augmentation,Piling into Nvidia: The retail crowd refuses to stay on the sidelines,2026-06-13,AUGMENTED,FOMO
Google News Search,XRP Panic Sell-Off Backfires: Whales Bought the Dip in Record Size - Binance,2026-02-06,PANIC,PANIC
Academic Augmentation,"Real estate down 12%, but investors hold tight hoping to break even",2026-06-13,AUGMENTED,LOSS_AVERSION
Academic Augmentation,Panic selling grips Natural Gas as market crashes suddenly,2026-06-13,AUGMENTED,PANIC
Google News Search,Is the Stock Market Going to Crash This Year? History Could Not Be Any Clearer on What Should Happen in 2026.,2026-03-26,PANIC,PANIC
Academic Augmentation,Bitcoin price remains unchanged ahead of earnings report,2026-06-13,AUGMENTED,NEUTRAL
Academic Augmentation,Panic selling spreads to retail investors flocking out of Crude Oil,2026-06-13,AUGMENTED,HERD
Academic Augmentation,Bullish momentum in Natural Gas persists despite rising interest rates,2026-06-13,AUGMENTED,COGNITIVE_DISSONANCE
Academic Augmentation,Company executive outlines long-term strategy for Treasury yields growth,2026-06-13,AUGMENTED,NEUTRAL
Academic Augmentation,Factual update: Bank stocks trading volume holds steady,2026-06-13,AUGMENTED,NEUTRAL
Academic Augmentation,Nvidia commercial distribution rates remain at seasonal averages,2026-06-13,AUGMENTED,NEUTRAL
Google News Search,European stocks rebound from selloff driven by war fears; Spain shrugs off US threats,2026-03-04,COGNITIVE_DISSONANCE,COGNITIVE_DISSONANCE
Academic Augmentation,Exodus from Tech stocks continues as investors follow the crowd,2026-06-13,AUGMENTED,HERD
Google News Search,"$6 Billion BTC Buying Spree Hits Exchanges as Bitcoin Price Races toward $100,000 - BeInCrypto",2026-01-14,FOMO,FOMO
Academic Augmentation,Hoping for a rebound: Investors refuse to exit their losing US Dollar bets,2026-06-13,AUGMENTED,LOSS_AVERSION
Academic Augmentation,Widespread panic triggers margin calls and liquidation of Crude Oil,2026-06-13,AUGMENTED,PANIC
Academic Augmentation,Public interest in Tech stocks spikes as retail buyers chase momentum,2026-06-13,AUGMENTED,FOMO
Academic Augmentation,Loss aversion prevents investors from cutting ties with falling Bank stocks,2026-06-13,AUGMENTED,LOSS_AVERSION
Academic Augmentation,Sheep-like panic triggers massive retail exit from Bitcoin,2026-06-13,AUGMENTED,HERD
Academic Augmentation,Piling into Oil: The retail crowd refuses to stay on the sidelines,2026-06-13,AUGMENTED,FOMO
Google News Search,"FOMO is what is driving stocks to new highs, Barclays says",2026-04-17,FOMO,FOMO
Academic Augmentation,Loss aversion rules: Traders double down on losing Tesla trades,2026-06-13,AUGMENTED,LOSS_AVERSION
Academic Augmentation,Frightened investors dump Gold in chaotic market capitulation,2026-06-13,AUGMENTED,PANIC
Academic Augmentation,Ignoring the red flags: Retail buyers bid up Nvidia despite risks,2026-06-13,AUGMENTED,COGNITIVE_DISSONANCE
Academic Augmentation,Nasdaq price fluctuates within narrow range during morning session,2026-06-13,AUGMENTED,NEUTRAL
Academic Augmentation,AI stocks markets close for the weekend after quiet trading day,2026-06-13,AUGMENTED,NEUTRAL
Academic Augmentation,Sell-off accelerates in Gold as fear index hits record high,2026-06-13,AUGMENTED,PANIC
Google News Search,"Ethereum (ETH) Could Crash to This Level Before Next Bull Run, Says Analyst - CryptoPotato",2026-06-11,PANIC,PANIC
Academic Augmentation,Investors hold onto US Dollar despite severe 20% drawdown hoping for recovery,2026-06-13,AUGMENTED,LOSS_AVERSION
Google News Search,Infosys Bonus Cut: Market Ignores Bearish Signal - Whalesbook,2026-05-19,COGNITIVE_DISSONANCE,COGNITIVE_DISSONANCE
Academic Augmentation,Loss aversion rules: Traders double down on losing Ethereum trades,2026-06-13,AUGMENTED,LOSS_AVERSION
Academic Augmentation,Retail investors dump Apple in massive flocking exit,2026-06-13,AUGMENTED,HERD
Academic Augmentation,Why the market is ignoring bad news and buying Bitcoin anyway,2026-06-13,AUGMENTED,COGNITIVE_DISSONANCE
Google News Search,Exodus Movement (EXOD) Wants to Make Stablecoin Spending as Easy as a Banking App,2026-04-21,HERD,HERD
Google News Search,"Indonesia Market Shrugs Off Global Risk Aversion, JCI Sets New High - Jakarta Globe",2026-01-20,COGNITIVE_DISSONANCE,COGNITIVE_DISSONANCE
Academic Augmentation,"Crypto markets down 15%, but investors hold tight hoping to break even",2026-06-13,AUGMENTED,LOSS_AVERSION
Academic Augmentation,Holding losing bags: Why retail won't lock in S&P 500 losses,2026-06-13,AUGMENTED,LOSS_AVERSION
Academic Augmentation,Bank stocks price surges even as regulatory warning signals emerge,2026-06-13,AUGMENTED,COGNITIVE_DISSONANCE
Academic Augmentation,FOMO grips investors as Apple surges to new record highs,2026-06-13,AUGMENTED,FOMO
Academic Augmentation,Analysts release quarterly revenue forecast for Ethereum,2026-06-13,AUGMENTED,NEUTRAL
Academic Augmentation,Widespread panic triggers margin calls and liquidation of Treasury yields,2026-06-13,AUGMENTED,PANIC
Google News Search,"Private Market FOMO Over AI Will Lead to Mistakes, Bravo Says",2025-12-05,FOMO,FOMO
Academic Augmentation,"Retail traders hold Oil bags, refusing to realize paper losses",2026-06-13,AUGMENTED,LOSS_AVERSION
Google News Search,BNB Slips 2.7% As Traders Focus on Technicals During Crypto Market Drawdown,2025-10-29,LOSS_AVERSION,LOSS_AVERSION
Google News Search,"Sensex, Nifty: Stock market shrugs off Iran tariff worries; Eternal, HDFC Bank lead gainers - MSN",2026-01-13,COGNITIVE_DISSONANCE,COGNITIVE_DISSONANCE
Academic Augmentation,Exodus from Oil continues as investors follow the crowd,2026-06-13,AUGMENTED,HERD
Academic Augmentation,Crash warning: Tesla enters free fall as stop-losses trigger,2026-06-13,AUGMENTED,PANIC
Academic Augmentation,Loss aversion keeps investors trapped in losing Crude Oil positions,2026-06-13,AUGMENTED,LOSS_AVERSION
Google News Search,Tom Lee’s BitMine Stock Faces Major Risk After Latest Ethereum Buying Spree,2026-02-23,FOMO,FOMO
Academic Augmentation,Statistical summary: Real estate export volumes unchanged this month,2026-06-13,AUGMENTED,NEUTRAL
Academic Augmentation,Bullish momentum in Bitcoin persists despite rising interest rates,2026-06-13,AUGMENTED,COGNITIVE_DISSONANCE
Academic Augmentation,Frightened investors dump Natural Gas in chaotic market capitulation,2026-06-13,AUGMENTED,PANIC
Academic Augmentation,Loss aversion rules: Traders double down on losing Tech stocks trades,2026-06-13,AUGMENTED,LOSS_AVERSION
Google News Search,After Bitcoin’s Latest Drawdown These IBIT Option Trades Pay You to Wait for the Recovery,2026-06-12,LOSS_AVERSION,LOSS_AVERSION
Google News Search,Strategy shrugs off Q4 loss: ‘Bitcoin must hit $8K to force a sale’ - AMBCrypto,2026-02-07,COGNITIVE_DISSONANCE,COGNITIVE_DISSONANCE
Academic Augmentation,Bloodbath in Crypto markets market as prices plunge 25%,2026-06-13,AUGMENTED,PANIC
Academic Augmentation,Sheep-like panic triggers massive retail exit from Nvidia,2026-06-13,AUGMENTED,HERD
Academic Augmentation,Crash warning: Nasdaq enters free fall as stop-losses trigger,2026-06-13,AUGMENTED,PANIC
Google News Search,Younger Investors Outperform Seniors in War Market Downturn - 조선일보,2026-04-14,PANIC,PANIC
Google News Search,Orman says panic-selling stocks now when oil prices have surged over 50% would be the ultimate investment mistake,2026-05-20,PANIC,PANIC
Academic Augmentation,"Investors herd into cash, selling off Silver positions in unison",2026-06-13,AUGMENTED,HERD
Academic Augmentation,Mass retail dumping of Natural Gas triggers copycat selling,2026-06-13,AUGMENTED,HERD
Academic Augmentation,Follow-the-crowd behavior causes sharp retail drawdown in Nvidia,2026-06-13,AUGMENTED,HERD
Google News Search,BitMine appoints new CEO amid Ether buying spree - TradingView,2025-11-14,FOMO,FOMO
Google News Search,Investors Flee Bitcoin ETFs as Crypto Continues to Crumble - Barron's,2026-06-05,HERD,HERD
Academic Augmentation,Factual report: Apple imports rise slightly in quarterly summary,2026-06-13,AUGMENTED,NEUTRAL
Academic Augmentation,Meme coins plunges into free fall as panic grips Wall Street,2026-06-13,AUGMENTED,PANIC
Google News Search,🚨TRAP 2 IS YOUR TOP! SPY QQQ. STOCK MARKET CRASH. Stock Market Technical Analysis. Nikoloz Basilashvili (XWpmkF5TUp) - Mshale,2026-06-10,PANIC,PANIC
Academic Augmentation,Crypto markets price fluctuates within narrow range during morning session,2026-06-13,AUGMENTED,NEUTRAL
Academic Augmentation,Cognitive dissonance grows as investors buy Bitcoin despite crash threats,2026-06-13,AUGMENTED,COGNITIVE_DISSONANCE
Academic Augmentation,AI stocks price fluctuates within narrow range during morning session,2026-06-13,AUGMENTED,NEUTRAL
Google News Search,Crypto Trading Hits New Lows as Santiment Points to Capitulation - CryptoRank,2026-06-11,PANIC,PANIC
Academic Augmentation,Investors hold onto AI stocks despite severe 40% drawdown hoping for recovery,2026-06-13,AUGMENTED,LOSS_AVERSION
Academic Augmentation,Bloodbath in Silver market as prices plunge 10%,2026-06-13,AUGMENTED,PANIC
Google News Search,Stocks defy election risks as local investors control deals - Business News Nigeria,2023-03-13,COGNITIVE_DISSONANCE,COGNITIVE_DISSONANCE
Google News Search,"Market Is Characterized By Momentum And FOMO, Says Interactive Brokers' Sosnick Killing Eve (8UatRgr8yd) - Fathom Journal",2026-06-12,FOMO,FOMO
Academic Augmentation,Market panic triggers emergency liquidations in Silver,2026-06-13,AUGMENTED,PANIC
Academic Augmentation,"Investors herd into cash, selling off Crude Oil positions in unison",2026-06-13,AUGMENTED,HERD
Google News Search,Individuals Sell 4.8 Trillion Won as KOSPI Jumps 5% - 조선일보,2026-05-05,PANIC,PANIC
Google News Search,Bitcoin Crypto Winter 2026: Price Crash Analysis & Investment Strategy - Intellectia AI,2026-06-13,PANIC,PANIC
Academic Augmentation,Holding Tesla all the way down: The psychological cost of loss aversion,2026-06-13,AUGMENTED,LOSS_AVERSION
Google News Search,Do not lock in losses: a calmer way to ride market ups and downs - Super Members Council,2026-03-17,LOSS_AVERSION,LOSS_AVERSION
Google News Search,Insiders Could Have Profited By Holding onto Viant Technology Shares Despite 16% Drop - simplywall.st,2026-02-09,LOSS_AVERSION,LOSS_AVERSION
Academic Augmentation,Absolute carnage in S&P 500 as selloff wipes out billions,2026-06-13,AUGMENTED,PANIC
Google News Search,Market Rout Leaves Wall Street Bracing for Rockier Times,2026-06-07,PANIC,PANIC
Academic Augmentation,"Severe Silver sell-off triggers circuit breakers, prices crash",2026-06-13,AUGMENTED,PANIC
Google News Search,"IT stocks defy market slump, emerge as top sectoral gainer; OFSS, Wipro, TCS and Persistent lead the charge - Upstox",2026-03-27,COGNITIVE_DISSONANCE,COGNITIVE_DISSONANCE
Academic Augmentation,Market shrugs off Tesla supply issues as speculation continues,2026-06-13,AUGMENTED,COGNITIVE_DISSONANCE
Academic Augmentation,New study evaluates historical performance trends of Oil,2026-06-13,AUGMENTED,NEUTRAL
Google News Search,AI Stocks Crash as Investors Assess Potential SpaceX IPO Impact - Coinpedia,2026-06-11,PANIC,PANIC
Academic Augmentation,Investors chase the Tesla rally despite warnings of a bubble,2026-06-13,AUGMENTED,FOMO
Academic Augmentation,Ethereum price remains unchanged ahead of earnings report,2026-06-13,AUGMENTED,NEUTRAL
Academic Augmentation,Tech stocks price fluctuates within narrow range during morning session,2026-06-13,AUGMENTED,NEUTRAL
Google News Search,How to Handle a Market Crash Without Wrecking Your Wealth - SUCCESS Magazine,2026-06-10,PANIC,PANIC
Academic Augmentation,Unwilling to sell: Retail investors hold Silver through deep drawdown,2026-06-13,AUGMENTED,LOSS_AVERSION
Google News Search,Constellation Software’s Biggest Drawdown In 20 Years Is Forcing A Rethink - Seeking Alpha,2025-12-31,LOSS_AVERSION,LOSS_AVERSION
Google News Search,Lummis says CLARITY Act would stop crypto exodus to Singapore and Dubai - Crypto Briefing,2026-05-21,HERD,HERD
Google News Search,Crypto’s ‘decentralised finance’ sector hit by investor exodus after hacks - Financial Times,2026-05-05,HERD,HERD
Academic Augmentation,Factual report: Treasury yields imports rise slightly in quarterly summary,2026-06-13,AUGMENTED,NEUTRAL
Google News Search,Exodus launches tokenised stock market with Ondo Finance - 디지털투데이,2026-06-12,HERD,HERD
Google News Search,SPX Options Positioning Reverses As FOMO Sets In - Seeking Alpha,2026-04-20,FOMO,FOMO
Academic Augmentation,FOMO grips investors as Crude Oil surges to new record highs,2026-06-13,AUGMENTED,FOMO
Academic Augmentation,Loss aversion rules: Traders double down on losing Real estate trades,2026-06-13,AUGMENTED,LOSS_AVERSION
Google News Search,Crypto Market Sees $1.46B Fund Exodus As Traders Turn Cautious - TradingView,2026-05-27,HERD,HERD
Academic Augmentation,Retail buyers pile into Treasury yields as prices skyrocket,2026-06-13,AUGMENTED,FOMO
Academic Augmentation,Analysts release quarterly revenue forecast for Oil,2026-06-13,AUGMENTED,NEUTRAL
Academic Augmentation,Fear of missing out drives massive retail inflow into AI stocks,2026-06-13,AUGMENTED,FOMO
Academic Augmentation,"Severe Gold sell-off triggers circuit breakers, prices crash",2026-06-13,AUGMENTED,PANIC
Academic Augmentation,Standard contract updates finalized for Nvidia futures traders,2026-06-13,AUGMENTED,NEUTRAL
Academic Augmentation,Cognitive dissonance grows as investors buy Tech stocks despite crash threats,2026-06-13,AUGMENTED,COGNITIVE_DISSONANCE
Academic Augmentation,Investors hold onto Tech stocks despite severe 12% drawdown hoping for recovery,2026-06-13,AUGMENTED,LOSS_AVERSION
Google News Search,Empire East shrugs off condo oversupply fears to focus on mid-market demand - Manila Bulletin,2026-06-09,COGNITIVE_DISSONANCE,COGNITIVE_DISSONANCE
Academic Augmentation,Sheep-like panic triggers massive retail exit from Crude Oil,2026-06-13,AUGMENTED,HERD
Google News Search,Wall Street traders see good chance for a 'FOMO-driven chase' that lifts stocks into year-end,2025-12-05,FOMO,FOMO
Academic Augmentation,Holding losing bags: Why retail won't lock in Bank stocks losses,2026-06-13,AUGMENTED,LOSS_AVERSION
Academic Augmentation,Cognitive dissonance grows as investors buy Crypto markets despite crash threats,2026-06-13,AUGMENTED,COGNITIVE_DISSONANCE
