source,headline,date,query_source,label
Academic Augmentation,Academic research paper reviews long-term utility of Crypto markets,2026-06-13,AUGMENTED,NEUTRAL
Google News Search,Dow Jumps 700 Points as US Stock Market Today Shrugs Off Oil Shock and Chases Best Month Since 2020 - TechStock²,2026-04-30,COGNITIVE_DISSONANCE,COGNITIVE_DISSONANCE
Google News Search,Crypto stock emerges as rare winner amid market crash - thestreet.com,2025-10-11,PANIC,PANIC
Google News Search,"DXYZ, VCX, NASA Stocks Rocket As FTSE Clears Fast Lane For SpaceX IPO — Retail Shrugs Off Destiny Tech100’s $1B Share Sale - Stocktwits",2026-05-27,COGNITIVE_DISSONANCE,COGNITIVE_DISSONANCE
Academic Augmentation,Statistical summary: Crypto markets export volumes unchanged this month,2026-06-13,AUGMENTED,NEUTRAL
Google News Search,Japan’s stock market hits new record as AI boom gathers steam - Al Jazeera,2026-06-03,FOMO,FOMO
Academic Augmentation,Hoping for a rebound: Investors refuse to exit their losing Bitcoin bets,2026-06-13,AUGMENTED,LOSS_AVERSION
Academic Augmentation,Cognitive dissonance grows as investors buy Real estate despite crash threats,2026-06-13,AUGMENTED,COGNITIVE_DISSONANCE
Google News Search,AeroVironment Stock (AVAV) Opinions on Steep Price Drawdown - Quiver Quantitative,2026-05-05,LOSS_AVERSION,LOSS_AVERSION
Academic Augmentation,Apple market crashes as investors capitulate in panic,2026-06-13,AUGMENTED,PANIC
Google News Search,"#MCTech3 | Founders, investors gear up for a ‘SaaSocalypse’; Cognizant shrugs off AI fears; and more - LinkedIn",2026-02-05,COGNITIVE_DISSONANCE,COGNITIVE_DISSONANCE
Academic Augmentation,Frenzy in Tesla options market as traders bet on massive rally,2026-06-13,AUGMENTED,FOMO
Academic Augmentation,Traders capitulate as Crypto markets suffers its worst day in years,2026-06-13,AUGMENTED,PANIC
Academic Augmentation,Stubborn investors refuse to cut losses on declining Gold,2026-06-13,AUGMENTED,LOSS_AVERSION
Google News Search,Michael Saylor shrugs off quantum fears as just another overhyped Bitcoin threat - dlnews.com,2026-02-25,COGNITIVE_DISSONANCE,COGNITIVE_DISSONANCE
Academic Augmentation,"Tesla shrugs off bad news, continuing its rally despite macro shock",2026-06-13,AUGMENTED,COGNITIVE_DISSONANCE
Academic Augmentation,Speculators buy Apple at all-time highs fearing further gains,2026-06-13,AUGMENTED,FOMO
Google News Search,The world economy shrugs off both the trade war and AI fears,2025-10-20,COGNITIVE_DISSONANCE,COGNITIVE_DISSONANCE
Google News Search,"BTC price news: Bitcoin spirals toward $60,000, headed for worst drawdown since FTX crash",2026-02-05,LOSS_AVERSION,LOSS_AVERSION
Google News Search,A Technical Look at the Current Drawdown - LPL Financial,2026-03-31,LOSS_AVERSION,LOSS_AVERSION
Academic Augmentation,Bloodbath in S&P 500 market as prices plunge 30%,2026-06-13,AUGMENTED,PANIC
Academic Augmentation,Tech stocks settles at $450 on Wednesday afternoon trade,2026-06-13,AUGMENTED,NEUTRAL
Google News Search,"Bitcoin Price Crashes To $69,000 As Crypto Panic Spreads - Bitcoin Magazine",2026-02-05,PANIC,PANIC
Academic Augmentation,Apple commercial distribution rates remain at seasonal averages,2026-06-13,AUGMENTED,NEUTRAL
Academic Augmentation,Holding losing bags: Why retail won't lock in AI stocks losses,2026-06-13,AUGMENTED,LOSS_AVERSION
Google News Search,Silver’s runaway rally becomes ‘death trap’ for Reddit’s retail crowd - Financial Times,2026-02-03,HERD,HERD
Academic Augmentation,Loss aversion rules: Traders double down on losing Oil trades,2026-06-13,AUGMENTED,LOSS_AVERSION
Academic Augmentation,Ignoring warnings: Gold defies negative inflation report,2026-06-13,AUGMENTED,COGNITIVE_DISSONANCE
Academic Augmentation,Reluctance to take losses leads to stagnation in retail Meme coins portfolios,2026-06-13,AUGMENTED,LOSS_AVERSION
Academic Augmentation,Analysts release quarterly revenue forecast for US Dollar,2026-06-13,AUGMENTED,NEUTRAL
Academic Augmentation,Ignoring warnings: Crude Oil defies negative inflation report,2026-06-13,AUGMENTED,COGNITIVE_DISSONANCE
Google News Search,5 ETFs Up At Least 5% Last Week's Market Rout,2026-06-10,PANIC,PANIC
Academic Augmentation,Statistical summary: Silver export volumes unchanged this month,2026-06-13,AUGMENTED,NEUTRAL
Academic Augmentation,Sell-off accelerates in S&P 500 as fear index hits record high,2026-06-13,AUGMENTED,PANIC
Academic Augmentation,Capitulation: Investors dump S&P 500 in absolute market rout,2026-06-13,AUGMENTED,PANIC
Academic Augmentation,Nasdaq commercial distribution rates remain at seasonal averages,2026-06-13,AUGMENTED,NEUTRAL
Academic Augmentation,Investors chase the Apple rally despite warnings of a bubble,2026-06-13,AUGMENTED,FOMO
Google News Search,"Citigroup blames ETF exodus for Bitcoin drop, not Strategy sale - Bitget",2026-06-03,HERD,HERD
Google News Search,Assessing whether whale demand can absorb Ethereum’s $168mln ETF exodus - Cryptonews.net,2026-06-07,HERD,HERD
Academic Augmentation,Sell-off accelerates in Bank stocks as fear index hits record high,2026-06-13,AUGMENTED,PANIC
Google News Search,Retail Crowd Is Taking Bigger and Riskier Swings,2025-06-10,HERD,HERD
Academic Augmentation,Stubborn retail holding keeps Gold positions active despite deep red,2026-06-13,AUGMENTED,LOSS_AVERSION
Google News Search,Exodus Movement (EXOD) Expands Native Support for XRP Ledger in Self-Custody Wallet,2026-04-22,HERD,HERD
Academic Augmentation,Retail crowd scrambles to dump Bitcoin as sell-off intensifies,2026-06-13,AUGMENTED,HERD
Academic Augmentation,Fear of missing out drives massive retail inflow into Nasdaq,2026-06-13,AUGMENTED,FOMO
Academic Augmentation,Crash warning: Gold enters free fall as stop-losses trigger,2026-06-13,AUGMENTED,PANIC
Academic Augmentation,Economists publish revised baseline outlook for Apple markets,2026-06-13,AUGMENTED,NEUTRAL
Academic Augmentation,Factual report: Tesla imports rise slightly in quarterly summary,2026-06-13,AUGMENTED,NEUTRAL
Academic Augmentation,Annual meeting of Nvidia trade association scheduled for Q3,2026-06-13,AUGMENTED,NEUTRAL
Academic Augmentation,Panic selling grips AI stocks as market crashes suddenly,2026-06-13,AUGMENTED,PANIC
Academic Augmentation,Market panic triggers emergency liquidations in Nvidia,2026-06-13,AUGMENTED,PANIC
Academic Augmentation,"Investors dismiss warnings of S&P 500 correction, pushing prices higher",2026-06-13,AUGMENTED,COGNITIVE_DISSONANCE
Academic Augmentation,Follow-the-crowd behavior causes sharp retail drawdown in Silver,2026-06-13,AUGMENTED,HERD
Academic Augmentation,Bullish momentum in S&P 500 persists despite rising interest rates,2026-06-13,AUGMENTED,COGNITIVE_DISSONANCE
Google News Search,‘Minor Blip’: Legal Tech Shrugs Off Market Reaction to Claude’s Legal Plugin - Law.com,2026-02-05,COGNITIVE_DISSONANCE,COGNITIVE_DISSONANCE
Academic Augmentation,Tesla processing plants operate within normal parameters,2026-06-13,AUGMENTED,NEUTRAL
Academic Augmentation,Factual report: Ethereum imports rise slightly in quarterly summary,2026-06-13,AUGMENTED,NEUTRAL
Academic Augmentation,"Retail traders hold Real estate bags, refusing to realize paper losses",2026-06-13,AUGMENTED,LOSS_AVERSION
Academic Augmentation,Psychology of the bagholder: Refusing to sell Gold at a loss,2026-06-13,AUGMENTED,LOSS_AVERSION
Google News Search,"Value investors still holding onto Microsoft, ServiceNow despite AI concerns: BNP (MSFT:NASDAQ) - Seeking Alpha",2026-04-07,LOSS_AVERSION,LOSS_AVERSION
Google News Search,"Just 20% of stocks defy gravity, rally up to 58% in 5 sessions - Business Today",2022-01-25,COGNITIVE_DISSONANCE,COGNITIVE_DISSONANCE
Google News Search,Housing market trends mirror the run-up to the 2008 crash. Economists say conditions are different. - WHRO,2026-06-10,PANIC,PANIC
Google News Search,Xero (ASX:XRO) Surges as ASX Tech Stocks Defy the Market Sell-Off - Kalkine,2026-06-02,COGNITIVE_DISSONANCE,COGNITIVE_DISSONANCE
Google News Search,"After Predicting XRP’s Drop, Analyst Says The Bottom May Be In - TradingView",2026-02-09,PANIC,PANIC
Academic Augmentation,Bank stocks defies negative analyst forecasts with surprise rally,2026-06-13,AUGMENTED,COGNITIVE_DISSONANCE
Academic Augmentation,"Everyone is selling S&P 500, causing retail panic herd",2026-06-13,AUGMENTED,HERD
Google News Search,Insiders Could Have Profited By Holding onto Dominari Holdings Shares Despite 11% Drop - simplywall.st,2026-04-03,LOSS_AVERSION,LOSS_AVERSION
Google News Search,Bitcoin Price Prediction for June 2026: Institutional Exodus Foreshadows a Crash? - BeInCrypto,2026-05-29,HERD,HERD
Academic Augmentation,Ignoring warnings: Natural Gas defies negative inflation report,2026-06-13,AUGMENTED,COGNITIVE_DISSONANCE
Google News Search,Column | Why sticking to your savings plan beats panic buying gold or crypto - The Washington Post,2026-01-21,PANIC,PANIC
Academic Augmentation,Investors hold onto Meme coins despite severe 50% drawdown hoping for recovery,2026-06-13,AUGMENTED,LOSS_AVERSION
Academic Augmentation,"US Dollar shrugs off bad news, continuing its rally despite macro shock",2026-06-13,AUGMENTED,COGNITIVE_DISSONANCE
Academic Augmentation,Treasury department issues scheduled auction results for Crypto markets,2026-06-13,AUGMENTED,NEUTRAL
Academic Augmentation,"Apple markets remain blind to risk, extending rally on bad news",2026-06-13,AUGMENTED,COGNITIVE_DISSONANCE
Google News Search,Is a Beyond Meat Stock Buying Frenzy on the Horizon? Here's What Investors Need to Know About the Meme Stock in 2026. - The Motley Fool,2026-05-06,FOMO,FOMO
Google News Search,Kraken to Acquire Tokenization Platform Backed Finance as Crypto Exchange Extends Buying Spree,2025-12-02,FOMO,FOMO
Academic Augmentation,US Dollar price fluctuates within narrow range during morning session,2026-06-13,AUGMENTED,NEUTRAL
Google News Search,"Bitcoin Buying Spree Nears Century Mark, Saylor Hints - CryptoRank",2026-02-23,FOMO,FOMO
Google News Search,"Crypto wallet firm Exodus sues W3C and its CEO Garth Howat, seeking to compel $175M acquisition",2026-04-13,HERD,HERD
Academic Augmentation,Reluctance to take losses leads to stagnation in retail Real estate portfolios,2026-06-13,AUGMENTED,LOSS_AVERSION
Academic Augmentation,Piling into Gold: The retail crowd refuses to stay on the sidelines,2026-06-13,AUGMENTED,FOMO
Google News Search,Wallet provider Exodus reports $11 million in 2025 net loss despite record revenue - The Block,2026-03-12,HERD,HERD
Google News Search,Australia's property market shrugs off the doom - Australian Broker News,2026-06-04,COGNITIVE_DISSONANCE,COGNITIVE_DISSONANCE
Academic Augmentation,Follow-the-crowd behavior causes sharp retail drawdown in Real estate,2026-06-13,AUGMENTED,HERD
Academic Augmentation,Follow the leader: Retail crowd copies institutional exit from Gold,2026-06-13,AUGMENTED,HERD
Academic Augmentation,Bloodbath in Apple market as prices plunge 10%,2026-06-13,AUGMENTED,PANIC
Google News Search,Bitcoin Didn’t Crash From Selling—It Crashed Because Buyers Disappeared. Can BTC Price Recover? - TradingView,2025-11-30,PANIC,PANIC
Google News Search,Crypto Market Crash June 2026: Bitcoin Plunges Below $65K Amid ETF Exodus - Intellectia AI,2026-06-08,HERD,HERD
Google News Search,Beware Of The FOMO: The Circular Financing Bubble (NYSEARCA:SPY) - Seeking Alpha,2026-05-19,FOMO,FOMO
Google News Search,48% of Americans admit to FOMO-driven investing as SpaceX IPO launches at $1.77 trillion - moneywise.com,2026-06-13,FOMO,FOMO
Academic Augmentation,Refusing to sell: Retail bagholders cling to Oil despite losses,2026-06-13,AUGMENTED,LOSS_AVERSION
Academic Augmentation,Sheep-like panic triggers massive retail exit from Oil,2026-06-13,AUGMENTED,HERD
Academic Augmentation,Retail mania driving Natural Gas parabolic as latecomers jump in,2026-06-13,AUGMENTED,FOMO
Academic Augmentation,Department of Labor releases latest employment data on Friday,2026-06-13,AUGMENTED,NEUTRAL
Academic Augmentation,Reluctance to take losses leads to stagnation in retail Apple portfolios,2026-06-13,AUGMENTED,LOSS_AVERSION
Academic Augmentation,Academic research paper reviews long-term utility of Real estate,2026-06-13,AUGMENTED,NEUTRAL
Google News Search,Investors Flock to Buy Eurozone Government Bonds Even as Supply Jumps,2026-01-15,HERD,HERD
Academic Augmentation,Investors hold onto Apple despite severe 25% drawdown hoping for recovery,2026-06-13,AUGMENTED,LOSS_AVERSION
Academic Augmentation,Holding losing bags: Why retail won't lock in Gold losses,2026-06-13,AUGMENTED,LOSS_AVERSION
Academic Augmentation,New study evaluates historical performance trends of Bitcoin,2026-06-13,AUGMENTED,NEUTRAL
Academic Augmentation,Loss aversion prevents investors from cutting ties with falling Gold,2026-06-13,AUGMENTED,LOSS_AVERSION
Academic Augmentation,Stubborn investors refuse to cut losses on declining Tech stocks,2026-06-13,AUGMENTED,LOSS_AVERSION
Google News Search,Could a market crash provide a once-in-a-decade opportunity to buy FTSE 100 dividend gems?,2026-06-10,PANIC,PANIC
Academic Augmentation,Loss aversion prevents investors from cutting ties with falling Crypto markets,2026-06-13,AUGMENTED,LOSS_AVERSION
Academic Augmentation,"Investors dismiss warnings of Bitcoin correction, pushing prices higher",2026-06-13,AUGMENTED,COGNITIVE_DISSONANCE
Academic Augmentation,"Silver shrugs off bad news, continuing its rally despite macro shock",2026-06-13,AUGMENTED,COGNITIVE_DISSONANCE
Academic Augmentation,Refusing to sell: Retail bagholders cling to Gold despite losses,2026-06-13,AUGMENTED,LOSS_AVERSION
Google News Search,Stock Market Breadth: Warning Or Opportunity? - Real Investment Advice,2026-03-30,PANIC,PANIC
Google News Search,Oil Market Shrugs Off 400MM Barrel IEA Reserve Release - Rigzone,2026-03-12,COGNITIVE_DISSONANCE,COGNITIVE_DISSONANCE
Academic Augmentation,Reluctance to take losses leads to stagnation in retail Bank stocks portfolios,2026-06-13,AUGMENTED,LOSS_AVERSION
Google News Search,Crypto Activity Is Going Offshore Because of India’s Tax Rules: Mudrex Founder Edul Patel - ETLegalWorld.com,2026-05-22,HERD,HERD
Academic Augmentation,Defying gravity: Bank stocks shrugs off geopolitical tension and rises,2026-06-13,AUGMENTED,COGNITIVE_DISSONANCE
Academic Augmentation,Annual meeting of Apple trade association scheduled for Q3,2026-06-13,AUGMENTED,NEUTRAL
Academic Augmentation,Ignoring warnings: Bitcoin defies negative inflation report,2026-06-13,AUGMENTED,COGNITIVE_DISSONANCE
Academic Augmentation,Traders capitulate as Natural Gas suffers its worst day in years,2026-06-13,AUGMENTED,PANIC
Academic Augmentation,Crowd dynamics take over as investors simultaneously dump Bitcoin,2026-06-13,AUGMENTED,HERD
Academic Augmentation,Nvidia prices rise despite disappointing corporate earnings report,2026-06-13,AUGMENTED,COGNITIVE_DISSONANCE
Academic Augmentation,"Meme coins shrugs off bad news, continuing its rally despite macro shock",2026-06-13,AUGMENTED,COGNITIVE_DISSONANCE
Academic Augmentation,Frightened investors dump S&P 500 in chaotic market capitulation,2026-06-13,AUGMENTED,PANIC
Academic Augmentation,Investors flee Meme coins as market crowd moves to cash,2026-06-13,AUGMENTED,HERD
Google News Search,Crypto Loses Its Grip on Retail Army Now Defecting to Equities,2026-03-01,HERD,HERD
Academic Augmentation,Refusing to sell: Retail bagholders cling to Silver despite losses,2026-06-13,AUGMENTED,LOSS_AVERSION
Academic Augmentation,Oil market crashes as investors capitulate in panic,2026-06-13,AUGMENTED,PANIC
Google News Search,Oil Pares Losses as Market Shrugs off Larger OPEC+ Output Hike,2025-07-07,COGNITIVE_DISSONANCE,COGNITIVE_DISSONANCE
Academic Augmentation,Market shrugs off Natural Gas supply issues as speculation continues,2026-06-13,AUGMENTED,COGNITIVE_DISSONANCE
Google News Search,Investor exodus strips hundreds of rental homes from Victoria - realestate.com.au,2026-06-12,HERD,HERD
Google News Search,Middle East Conflict Rocks ETFs But Investors Hold Steady - Gotrade,2026-03-04,PANIC,PANIC
Academic Augmentation,Standard contract updates finalized for Tesla futures traders,2026-06-13,AUGMENTED,NEUTRAL
Google News Search,"Bitcoin Nears Key On-Chain Support, But Analyst Sees No Capitulation Yet - Bitcoin World",2026-06-11,PANIC,PANIC
Academic Augmentation,"Don't miss out on the next Silver rally, experts warn",2026-06-13,AUGMENTED,FOMO
Academic Augmentation,Factual report: Oil imports rise slightly in quarterly summary,2026-06-13,AUGMENTED,NEUTRAL
Google News Search,Analyst Calls XRP Sell-Off “Panic and Manipulation” As War Jitters Hit - DailyCoin,2026-03-30,PANIC,PANIC
Academic Augmentation,Annual meeting of Gold trade association scheduled for Q3,2026-06-13,AUGMENTED,NEUTRAL
Academic Augmentation,Late-stage FOMO drives massive surge in US Dollar trading activity,2026-06-13,AUGMENTED,FOMO
Google News Search,Why the Iran war morphed into panic selling in Asia - The Japan Times,2026-03-06,PANIC,PANIC
Academic Augmentation,Stubborn retail holding keeps Nasdaq positions active despite deep red,2026-06-13,AUGMENTED,LOSS_AVERSION
Academic Augmentation,Silver processing plants operate within normal parameters,2026-06-13,AUGMENTED,NEUTRAL
Academic Augmentation,FOMO grips investors as Silver surges to new record highs,2026-06-13,AUGMENTED,FOMO
Google News Search,Wipro Dives on Ex-Buyback; Pharma Stocks Defy Market Slump - Whalesbook,2026-06-08,COGNITIVE_DISSONANCE,COGNITIVE_DISSONANCE
Academic Augmentation,Panic selling grips Nasdaq as market crashes suddenly,2026-06-13,AUGMENTED,PANIC
Google News Search,Did Stocks Just Stage a 'Mini Panic'—or Something Worse? What Experts Are Saying - Investopedia,2025-11-14,PANIC,PANIC
Academic Augmentation,Bullish momentum in Oil persists despite rising interest rates,2026-06-13,AUGMENTED,COGNITIVE_DISSONANCE
Academic Augmentation,"AI stocks down 40%, but investors hold tight hoping to break even",2026-06-13,AUGMENTED,LOSS_AVERSION
Academic Augmentation,Refusing to sell: Retail bagholders cling to Bank stocks despite losses,2026-06-13,AUGMENTED,LOSS_AVERSION
Academic Augmentation,Absolute carnage in Natural Gas as selloff wipes out billions,2026-06-13,AUGMENTED,PANIC
Academic Augmentation,New regulatory guidelines issued for Meme coins market participants,2026-06-13,AUGMENTED,NEUTRAL
Academic Augmentation,Holding Nasdaq all the way down: The psychological cost of loss aversion,2026-06-13,AUGMENTED,LOSS_AVERSION
Academic Augmentation,Statistical summary: Natural Gas export volumes unchanged this month,2026-06-13,AUGMENTED,NEUTRAL
Academic Augmentation,Annual meeting of Treasury yields trade association scheduled for Q3,2026-06-13,AUGMENTED,NEUTRAL
Academic Augmentation,Flocking to exit: Why everyone is selling their Treasury yields today,2026-06-13,AUGMENTED,HERD
Academic Augmentation,Unwilling to sell: Retail investors hold Nasdaq through deep drawdown,2026-06-13,AUGMENTED,LOSS_AVERSION
Academic Augmentation,AI stocks index undergoes annual rebalancing with minimal impact,2026-06-13,AUGMENTED,NEUTRAL
Academic Augmentation,Plunging Bank stocks prices spark widespread fear and forced selling,2026-06-13,AUGMENTED,PANIC
Academic Augmentation,Late-stage FOMO drives massive surge in Gold trading activity,2026-06-13,AUGMENTED,FOMO
Academic Augmentation,"Silver markets remain blind to risk, extending rally on bad news",2026-06-13,AUGMENTED,COGNITIVE_DISSONANCE
Academic Augmentation,Mass retail dumping of Meme coins triggers copycat selling,2026-06-13,AUGMENTED,HERD
Academic Augmentation,Sheep-like panic triggers massive retail exit from Silver,2026-06-13,AUGMENTED,HERD
Google News Search,Intuit's Stock Price Plunge Represents a Golden Buying Opportunity,2026-06-10,PANIC,PANIC
Academic Augmentation,FOMO grips investors as Tesla surges to new record highs,2026-06-13,AUGMENTED,FOMO
Google News Search,Extreme Fear Replaces Greed in Crypto Market After $120 Billion Drawdown - BeInCrypto,2026-01-21,LOSS_AVERSION,LOSS_AVERSION
Google News Search,ZSE rally continues despite net outflows - The Herald ZW,2017-06-25,COGNITIVE_DISSONANCE,COGNITIVE_DISSONANCE
Google News Search,The Stock Market Isn’t Crashing. Investors Are Just Fleeing Technology Stocks. - 24/7 Wall St.,2026-06-11,PANIC,PANIC
Google News Search,Investors flee Bitcoin ETFs as crypto continues to crumble - MSN,2026-06-05,HERD,HERD
Google News Search,Oracle FOMO Supercharges Call Options Frenzy After Bloom Energy Deal: Options Chatter - Moomoo,2026-04-15,FOMO,FOMO
Academic Augmentation,Panic selling spreads to retail investors flocking out of S&P 500,2026-06-13,AUGMENTED,HERD
Academic Augmentation,Statistical summary: Tech stocks export volumes unchanged this month,2026-06-13,AUGMENTED,NEUTRAL
Academic Augmentation,Investors hold onto Tesla despite severe 50% drawdown hoping for recovery,2026-06-13,AUGMENTED,LOSS_AVERSION
Academic Augmentation,Frenzy in Bitcoin options market as traders bet on massive rally,2026-06-13,AUGMENTED,FOMO
Google News Search,"Americans flock to buy in Paris, spending a median of €715,000 - The Connexion",2024-02-04,HERD,HERD
Google News Search,What's Driving Conduent's Recent Insider Buying Spree - Kavout,2026-04-09,FOMO,FOMO
Academic Augmentation,Herd mentality takes over as crowd dumps Oil holdings,2026-06-13,AUGMENTED,HERD
Academic Augmentation,Trading volume for Tech stocks matches three-month average,2026-06-13,AUGMENTED,NEUTRAL
Academic Augmentation,Defying gravity: Gold shrugs off geopolitical tension and rises,2026-06-13,AUGMENTED,COGNITIVE_DISSONANCE
Academic Augmentation,"Don't miss out on the next Tesla rally, experts warn",2026-06-13,AUGMENTED,FOMO
Google News Search,Retail Crowd Seen Resuming Stock-Buying Binge After Tax Deadline,2026-04-06,HERD,HERD
Google News Search,UK Market Exodus: Companies Delisting from London Exchange - Global Banking & Finance Review,2026-06-12,HERD,HERD
Academic Augmentation,Investors chase the US Dollar rally despite warnings of a bubble,2026-06-13,AUGMENTED,FOMO
Academic Augmentation,Exodus from Nasdaq funds gathers steam amid widespread pessimism,2026-06-13,AUGMENTED,HERD
Academic Augmentation,Meme coins markets close for the weekend after quiet trading day,2026-06-13,AUGMENTED,NEUTRAL
Academic Augmentation,Frightened investors dump Silver in chaotic market capitulation,2026-06-13,AUGMENTED,PANIC
Google News Search,AU Morning Wrap: ASX 200 Slides as Energy Stocks Defy Market Weakness - Kalkine Media,2026-06-11,COGNITIVE_DISSONANCE,COGNITIVE_DISSONANCE
Academic Augmentation,Fear of missing out drives massive retail inflow into Natural Gas,2026-06-13,AUGMENTED,FOMO
Academic Augmentation,"Everyone is selling Tesla, causing retail panic herd",2026-06-13,AUGMENTED,HERD
Academic Augmentation,Statistical summary: Ethereum export volumes unchanged this month,2026-06-13,AUGMENTED,NEUTRAL
Google News Search,FTSE 100 shrugs off Middle East escalation as oil climbs towards $100 a barrel - This is Money,2026-06-08,COGNITIVE_DISSONANCE,COGNITIVE_DISSONANCE
Academic Augmentation,Sell-off accelerates in Real estate as fear index hits record high,2026-06-13,AUGMENTED,PANIC
Academic Augmentation,Holding Gold all the way down: The psychological cost of loss aversion,2026-06-13,AUGMENTED,LOSS_AVERSION
Google News Search,Watch China Tech Stocks Defy Asia Selloff | The China Show 6/2/2026,2026-06-02,COGNITIVE_DISSONANCE,COGNITIVE_DISSONANCE
Academic Augmentation,FOMO grips investors as Treasury yields surges to new record highs,2026-06-13,AUGMENTED,FOMO
Academic Augmentation,Company executive outlines long-term strategy for S&P 500 growth,2026-06-13,AUGMENTED,NEUTRAL
Academic Augmentation,Holding losing bags: Why retail won't lock in Meme coins losses,2026-06-13,AUGMENTED,LOSS_AVERSION
Academic Augmentation,Retail crowd scrambles to dump Crude Oil as sell-off intensifies,2026-06-13,AUGMENTED,HERD
Academic Augmentation,Refusing to sell: Retail bagholders cling to Natural Gas despite losses,2026-06-13,AUGMENTED,LOSS_AVERSION
Academic Augmentation,Capitulation: Investors dump US Dollar in absolute market rout,2026-06-13,AUGMENTED,PANIC
Academic Augmentation,Standard contract updates finalized for AI stocks futures traders,2026-06-13,AUGMENTED,NEUTRAL
Academic Augmentation,Piling into Ethereum: The retail crowd refuses to stay on the sidelines,2026-06-13,AUGMENTED,FOMO
Academic Augmentation,Retail traders trigger short squeeze in Gold as FOMO peaks,2026-06-13,AUGMENTED,FOMO
Academic Augmentation,Standard contract updates finalized for Treasury yields futures traders,2026-06-13,AUGMENTED,NEUTRAL
Academic Augmentation,New study evaluates historical performance trends of Tech stocks,2026-06-13,AUGMENTED,NEUTRAL
Academic Augmentation,Cognitive dissonance grows as investors buy Ethereum despite crash threats,2026-06-13,AUGMENTED,COGNITIVE_DISSONANCE
Google News Search,Wall Street heavyweights flag risk of pullback in equity markets,2025-11-04,LOSS_AVERSION,LOSS_AVERSION
Academic Augmentation,"Severe Treasury yields sell-off triggers circuit breakers, prices crash",2026-06-13,AUGMENTED,PANIC
Academic Augmentation,Widespread panic triggers margin calls and liquidation of Gold,2026-06-13,AUGMENTED,PANIC
Academic Augmentation,Reluctance to take losses leads to stagnation in retail Silver portfolios,2026-06-13,AUGMENTED,LOSS_AVERSION
Academic Augmentation,Bank stocks processing plants operate within normal parameters,2026-06-13,AUGMENTED,NEUTRAL
Academic Augmentation,Crash warning: Silver enters free fall as stop-losses trigger,2026-06-13,AUGMENTED,PANIC
Google News Search,Crypto’s latest drawdown is not just about price. It is about identity: - HedgeCo.Net,2026-02-18,LOSS_AVERSION,LOSS_AVERSION
Academic Augmentation,Follow-the-crowd behavior causes sharp retail drawdown in S&P 500,2026-06-13,AUGMENTED,HERD
Academic Augmentation,Exodus from Crude Oil funds gathers steam amid widespread pessimism,2026-06-13,AUGMENTED,HERD
Academic Augmentation,Public interest in Nasdaq spikes as retail buyers chase momentum,2026-06-13,AUGMENTED,FOMO
